"Delaney","Delaney_office","1076487620232908801","2018-12-22 14:40:23","President Trump's shutdown is reckless and shows how incompetent he is. Federal workers and their families should not be punished for his dysfunction and I have cosponsored legislation (H.R. 7368) to ensure that furloughed workers are paid.","","21","83"
"Delaney","Delaney_office","1075388588836175872","2018-12-19 13:53:13","Congratulations to everyone at Urbana HS who made this happen! https://t.co/aQ6QvLlapt","","0","7"
"Delaney","Delaney_office","1073200329662054400","2018-12-13 12:57:52","RT @IntelPolicy: Starting Soon: The Reality of the Artificial, a conversation with @RepPeteOlson, @RepJohnDelaney and @RepDebDingell with @…","","2","0"
"Delaney","Delaney_office","1072672566014345216","2018-12-12 02:00:43","RT @IntelAI: Join us on 12/13 as we partner with @Axios on special event, #Axios360—featuring Intel’s Lisa Malloy, @RepJohnDelaney, @RepPet…","","9","0"
"Delaney","Delaney_office","1068547850127269888","2018-11-30 16:50:34","RT @audubonsociety: Audubon commends @RepTedDeutch, @RepRooney, @RepJohnDelaney, @RepBrianFitz, and @RepCharlieCrist for introducing a bipa…","","28","0"
"Delaney","Delaney_office","1067590263936303105","2018-11-28 01:25:28","RT @deantscott: .@RepTedDeutch along with Republicans @RepBrianFitz @RepRooney unveiled text of their climate (carbon tax returning 100% re…","","5","0"
"Delaney","Delaney_office","1067590136731439104","2018-11-28 01:24:58","RT @citizensclimate: Big news: There's a bipartisan carbon pricing bill in Congress. The Energy Innovation &amp; Carbon Dividend Act was just i…","","377","0"
"Delaney","Delaney_office","1065781164374458368","2018-11-23 01:36:45","Happy Thanksgiving! Hope you and yours had a wonderful day. Thank you to those in uniform who are away from their families today.","","5","41"
"Delaney","Delaney_office","1063185741667278849","2018-11-15 21:43:28","Delaney, Trott Introduce Bipartisan Legislation to Protect Veterans’ Finances  https://t.co/Gq572luHx2","","3","11"
"Delaney","Delaney_office","1060620289070039040","2018-11-08 19:49:16","Happy #Diwali to all those who celebrated yesterday and I wish all of you a joyous and prosperous year ahead. Sal Mubarak!","","2","15"
"Delaney","Delaney_office","1057991707487277056","2018-11-01 13:44:14","Delaney, Stewart Introduce Bipartisan Legislation to Modernize Suicide Prevention Analytics https://t.co/TBQaQ9haOJ","","0","8"
"Delaney","Delaney_office","1057648925027565569","2018-10-31 15:02:08","RT @AAUWActionFund: .@RepJohnDelaney received a 100% score in our Congressional Voting Record for the 115th Congress! #AAUW members and sup…","","1","0"
"Delaney","Delaney_office","1056905899766415363","2018-10-29 13:49:37","RT @DieselTechForum: Thank you @RepJohnDelaney for your staff's time to talk clean diesel at work in #Maryland. https://t.co/NfMbMUWgOg htt…","","1","0"
"Delaney","Delaney_office","1056905627149185024","2018-10-29 13:48:32","RT @HouseNewDems: Congratulations to all the #NewDems named 2018 @FixtheDebt Fiiscal Heroes! #NewDem Chair Emeritus @RepRonKind, @RepJohnDe…","","4","0"
"Delaney","Delaney_office","1055549181677449216","2018-10-25 19:58:30","RT @foxnewsradio: Over the past few days, suspicious packages containing bombs were found targeting certain public officials &amp; former lawma…","","3","0"
"Delaney","Delaney_office","1055548972608167936","2018-10-25 19:57:40","RT @HouseNewDems: ""All elected officials, including the President, have an obligation to tone down their rhetoric,"" @RepJohnDelaney joined…","","2","0"
"Delaney","Delaney_office","1055442007949230081","2018-10-25 12:52:38","RT @foxnewsradio: Over the past few days, suspicious packages containing bombs were found targeting certain public officials &amp; former lawma…","","4","0"
"Delaney","Delaney_office","1055441962063589377","2018-10-25 12:52:27","RT @foxnewsradio: ""All elected officials, including the President, have an obligation to tone down their rhetoric,"" @RepJohnDelaney discuss…","","3","0"
"Delaney","Delaney_office","1054164514164391941","2018-10-22 00:16:20","RT @FixtheDebt: .@RepJohnDelaney is one of our 2018 Fiscal Heroes. Thank you for your efforts to #fixthedebt.","","3","0"
"Delaney","Delaney_office","1052628575222988801","2018-10-17 18:33:03","I am honored to receive a perfect 100 on @HRC’s Congressional Scorecard for my support of LGBTQ #Equality. No one should be discriminated against because of who they are or who they love. #HRCScorecard @noh8 @LGBTEqCaucus https://t.co/6OU0LtfBjD https://t.co/eg2WFUnmco","","6","36"
"Delaney","Delaney_office","1052231047755288577","2018-10-16 16:13:25","RT @UMDgovtaffairs: Significant increase in funding to #UMD research priorities and student financial aid programs thanks to MD delegation…","","6","0"
"Delaney","Delaney_office","1047948182641102850","2018-10-04 20:34:51","Cardin, Van Hollen, Delaney Announce Essential Air Service Extension for Hagerstown Regional Airport  https://t.co/gxZHike4n7","","3","9"
"Delaney","Delaney_office","1045310906845089792","2018-09-27 13:55:15","This additional funding will allow Fisher House to help more families and that’s something both Republicans and Democrats have united behind.","","0","1"
"Delaney","Delaney_office","1045310905557426176","2018-09-27 13:55:15","Proud to see my amendment to increase funding for #FisherHouse included in the bill that passed the House last night  https://t.co/ioTm7P4lc6","","1","2"
"Delaney","Delaney_office","1045076006414024710","2018-09-26 22:21:51","RT @BeckiRFL: A big thank you to @RepJohnDelaney and staff for all of your support in increasing funding to NIH! #cancerlobbyday #ACSCAN #A…","","3","0"
"Delaney","Delaney_office","1044943005445234689","2018-09-26 13:33:21","Honored to be joining @NADAUpdate this morning. These business owners are leaders of their communities all across the country. https://t.co/gnHMNtZ3zl","","2","2"
"Delaney","Delaney_office","1042815699998199809","2018-09-20 16:40:12","As we await more details, our thoughts are with those in Harford County. Thank you to all our law enforcement officials who once again responded quickly to a scene that is happening far too often in Maryland and across the nation.","","2","5"
"Delaney","Delaney_office","1042129013333008384","2018-09-18 19:11:33","On this Yom Kippur, may all who observe have a meaningful fast.","","4","11"
"Delaney","Delaney_office","1041756792114569216","2018-09-17 18:32:28","Delaney Successful in Securing Funding for Fisher House https://t.co/AMnkSQdgwd","","2","5"
"Delaney","Delaney_office","1040705687142232064","2018-09-14 20:55:45","Hurricane Florence is proving to be a large and dangerous storm. Many of our fellow Americans are going to need assistance. That includes federal relief and support. We can't play politics with disaster relief. Let's all stand together and do the right thing for our citizens.","","6","17"
"Delaney","Delaney_office","1040248796758859776","2018-09-13 14:40:14","We cannot allow this administration to roll back these critical protections in the Affordable Care Act. Last week, I spoke on the House floor about this ongoing fight, and the need to secure more funding for suicide prevention and mental health programs. https://t.co/nhwsqSWKVm","","10","12"
"Delaney","Delaney_office","1039884771281842177","2018-09-12 14:33:44","Proud to work with @NAMICommunicate and @afspnational to seek additional resources for suicide prevention programs and to promote #NationalSuicidePreventionWeek. If you or someone you know is in crisis, call 1-800-273 TALK (8255) or text NAMI to 741-741.

https://t.co/hi2cRM7Pve","","2","5"
"Delaney","Delaney_office","1039870026009010176","2018-09-12 13:35:08","The House is in session this week. Here are the bills that are scheduled to come to the floor for a vote https://t.co/5C3bReSlnM","","6","4"
"Delaney","Delaney_office","1039542922553778178","2018-09-11 15:55:21","On the 17th anniversary of 9/11, we honor those we lost, the heroes who ran toward chaos, the men and women who have served and protected us in the years that followed, and all of their families. Through our darkest of days, we rise stronger when we are united. #NeverForget https://t.co/j8E5MwixNk","","5","15"
"Delaney","Delaney_office","1039261611800842240","2018-09-10 21:17:31","In anticipation of #HurricaneFlorence, please stay tuned to local forecasts and visit https://t.co/K3QsAcZexm, @MDMEMA, @NHC_Atlantic, @NWSNHC for up-to-date information, or call 1-877-MEMA-USA. We encourage everyone to stay safe and take all precautions through the week. https://t.co/HfbQbxLaAv","","6","7"
"Delaney","Delaney_office","1038877298156556289","2018-09-09 19:50:23","Wishing everyone celebrating a happy, healthy and sweet New Year. Shana Tova! #RoshHashanah","","4","12"
"Delaney","Delaney_office","1038094488357535744","2018-09-07 15:59:47","I was proud to work with Congressmen Serrano, Stewart, and Faso on this bipartisan letter to address gaps in mental health care.
https://t.co/hi2cRM7Pve","","3","8"
"Delaney","Delaney_office","1037791017821499392","2018-09-06 19:53:54","Hensarling-Delaney-Himes Announce Bipartisan Housing Finance Reform Act  https://t.co/ALIjUfphWw","","1","1"
"Delaney","Delaney_office","1037735763348279297","2018-09-06 16:14:20","Spoke in today's hearing on The Bipartisan Housing Finance Reform Act that Chairman @RepHensarling  &amp; @jahimes and I have been working on. Good faith effort at bipartisan compromise and fixing a broken system. Ten years on, we still need to reduce risk and boost affordability.","","1","2"
"Delaney","Delaney_office","1037716617713659906","2018-09-06 14:58:16","Today @RepHensarling @jahimes and I are announcing release of discussion draft of our Bipartisan Housing Finance Reform Act. We believe this is a blueprint for stabilizing the system and boosting affordable housing.","","2","2"
"Delaney","Delaney_office","1037396805204561922","2018-09-05 17:47:26","Reps. Gerry Connolly and Don Beyer of Virginia; Steny Hoyer, John Sarbanes John Delaney, Anthony Brown and Jamie Raskin of Maryland; and Eleanor Holmes Norton of D.C. called for an end to the “vilification” and “ongoing assault” on federal employees. https://t.co/N1aHohjyPl","","16","43"
"Delaney","Delaney_office","1037326498083090432","2018-09-05 13:08:04","RT @GerryConnolly: Trump's move to end a scheduled fed pay increase is cynical and another attack on federal employees. I joined @WhipHoyer…","","62","0"
"Delaney","Delaney_office","1036981670358994945","2018-09-04 14:17:51","Good luck to all the students, parents and educators going back to school today! Have a great school year.","","1","5"
"Delaney","Delaney_office","1036939453112242176","2018-09-04 11:30:05","RT @MCPS: Happy #MCPS1stDay! Have a wonderful day! https://t.co/KvA3ktGW5v","","40","0"
"Delaney","Delaney_office","1036770032116805633","2018-09-04 00:16:52","Way to go, Rose! Thank you to everyone who has volunteered to help local kids at Children In Need in Hagerstown. https://t.co/PsI5FE6FHW","","2","4"
"Delaney","Delaney_office","1036660391428927488","2018-09-03 17:01:12","Proud to stand with them today in supporting raising the minimum wage, equal pay for equal work, universal health care and the right to organize. #LaborDay","","2","7"
"Delaney","Delaney_office","1036660389726101505","2018-09-03 17:01:11","Happy Labor Day! Today we celebrate the talent, creativity and determination of hardworking Americans. Workers built this country brick by brick and created the strongest economy on the planet.","","6","12"
"Delaney","Delaney_office","1035539581628755972","2018-08-31 14:47:30","... And we still have leaders who will uphold the values that made America great, and a beacon to the oppressed.” As we gather at the Capitol to say our goodbyes today, may we always remember his example of public service and living a life with love and honor. Farewell, Senator.","","0","7"
"Delaney","Delaney_office","1035539580601200641","2018-08-31 14:47:30","Senator McCain in 2017 remarks to the Brigade of Midshipmen at his beloved Naval Academy: “I believe in Americans. We’re capable of better. I’ve seen it. We’re hopeful, compassionate people...","","4","10"
"Delaney","Delaney_office","1035537170155663362","2018-08-31 14:37:55","RT @AlexGangitano: House Reps I've seen so far in the Capitol: 2 local @RepJohnDelaney and @RepComstock. Also, @RepDanKildee","","3","0"
"Delaney","Delaney_office","1033736369657585665","2018-08-26 15:22:11","Senator McCain embodied service, honor and patriotism. He showed us how to be principled and strong while also being decent and respectful. Our prayers are with the Senator and his family. May this good man find eternal peace and serenity, for he has surely earned it.","","5","41"
"Delaney","Delaney_office","1033009414993838082","2018-08-24 15:13:31","Prayers for Senator McCain and his family https://t.co/T85U0THEpc","","2","17"
"Delaney","Delaney_office","1032697155432198146","2018-08-23 18:32:43","This Administration just has it completely backwards when it comes to gun safety. https://t.co/aAZYG18bvO","","3","5"
"Delaney","Delaney_office","1032695949779501056","2018-08-23 18:27:55","This effort by Trump/DeVos goes against the intent of bipartisan legislation passed in Congress this year. If they move forward with this plan, Congress should step in and protect students from the consequences of this policy.  https://t.co/qhO7559AsT","","5","8"
"Delaney","Delaney_office","1032694999136264192","2018-08-23 18:24:08","There’s a lot we should do to make our kids safer at school, but using federal funds to bring guns into classrooms isn’t one of them. https://t.co/MKz0PzKBUV","","4","20"
"Delaney","Delaney_office","1032014790405894146","2018-08-21 21:21:14","Today’s conviction of Manafort is yet more evidence that the Special Counsel’s investigation is not a witch hunt and that it must be allowed to continue without interference. https://t.co/nT7IZD9gfl","","10","21"
"Delaney","Delaney_office","1031982322059567106","2018-08-21 19:12:13","Cities, states, and responsible members of Congress alike must do everything we can to stop this assault on our environment and public health https://t.co/HchQWLnebd","","3","8"
"Delaney","Delaney_office","1031980658682421253","2018-08-21 19:05:36","Every American should be alarmed by what this White House is doing. President Trump doesn’t want to just ignore climate change, he wants to make things worse – this is going to impact our economy, public health and national security. https://t.co/wWagEjigHs","","15","24"
"Delaney","Delaney_office","1031977519547858944","2018-08-21 18:53:08","To all celebrating - Eid Mubarak! https://t.co/4lRMUI11Cd","","1","1"
"Delaney","Delaney_office","1030126584823463938","2018-08-16 16:18:11","In today’s world, we certainly need more of what Aretha Franklin taught us – RESPECT. May we celebrate her leadership on female empowerment and cherish her music for generations to come. God Bless the Queen of Soul.","","9","31"
"Delaney","Delaney_office","1029371294666706945","2018-08-14 14:16:56","We know that foreign adversaries are trying to undermine our elections and we know that we have vulnerabilities. We have to take this threat more seriously. Last month I introduced bill that would block foreign ownership and control of elections systems. https://t.co/8I49fgqKkJ","","5","16"
"Delaney","Delaney_office","1026647229770211328","2018-08-07 01:52:28","Proud to have introduced the Children and Media Research Advancement (CAMRA) Act in the House. 
Bipartisan ✅ Bicameral ✅ https://t.co/EChLNhEoTO","","3","9"
"Delaney","Delaney_office","1025120867414691840","2018-08-02 20:47:15","Reality once again proving that the argument that the GOP tax cuts would pay for themselves was completely untrue  https://t.co/0b1mRbSUu8","","12","25"
"Delaney","Delaney_office","1024396942238015490","2018-07-31 20:50:38","Last week I was proud to introduce legislation with @SenMarkey, @RepTedBudd, @SenSasse and others to authorize research at @NIH on technology and media’s impacts on infants, children, and adolescents. Read about the bill here: https://t.co/rKQ6s8LfUX","","2","8"
"Delaney","Delaney_office","1024356298400378880","2018-07-31 18:09:07","It's almost like the climate is changing and that this change will have major consequences, including ones that will also limit productivity and economic activity. https://t.co/6VljRKVhrV","","9","17"
"Delaney","Delaney_office","1024343999186956289","2018-07-31 17:20:15","I fully support @BrianFrosh making Maryland a leader on this issue and the work of other AGs across the nation to #stopdownloadableguns.  https://t.co/vcbE1eV6EU","","6","10"
"Delaney","Delaney_office","1024343998234865666","2018-07-31 17:20:15","We cannot allow untraceable and unregistered 3D-printed guns – especially without any safeguards or background checks. It’s inviting tragedy.","","6","13"
"Delaney","Delaney_office","1023994688263663616","2018-07-30 18:12:13","RT @LisaBettyCline: Thank you, @RepJohnDelaney, for calling for much needed science on how kids are impacted by screens. As safe technology…","","2","0"
"Delaney","Delaney_office","1022580151568228353","2018-07-26 20:31:21","This is a perfect example of serious legislation that deserves bipartisan support, and I hope my colleagues on both sides of the aisle work quickly to enact this into law.","","1","7"
"Delaney","Delaney_office","1022580150637092877","2018-07-26 20:31:21","Sexual and domestic violence affects more than 1 in 3 women in the United States, and funding for local law enforcement training and violence prevention programs is essential to helping women lead safer lives.","","0","7"
"Delaney","Delaney_office","1022580146908356611","2018-07-26 20:31:20","I am proud to be an original cosponsor of the 2018 reauthorization of the Violence Against Women Act, which would extend these vital policies while also making important enhancements to address wider forms of sexual violence. #VAWA18 https://t.co/uEQGHho2gm","","4","14"
"Delaney","Delaney_office","1022552565119156225","2018-07-26 18:41:44","RT @SenMarkey: I’ve introduced a bill with @SenSasse, Sen. @RoyBlunt, @SenBrianSchatz, @SenBennetCO, @SenatorCollins, @RepJohnDelaney, and…","","9","0"
"Delaney","Delaney_office","1022552428053495809","2018-07-26 18:41:11","This should have never happened and it should bring shame to all of us that it was done in our government’s name. #FamiliesBelongTogether @ACLU @HispanicCaucus @RepBarragan @RepEspaillat @RepGutierrez @RepRoybalAllard @JoaquinCastrotx @RepJudyChu @RepYvetteClarke @NormaJTorres","","2","9"
"Delaney","Delaney_office","1022552426858143745","2018-07-26 18:41:11","Despite what the @WhiteHouse and @DHSgov might claim, this remains a #humanitarian #Crisis that they caused, that they have not solved, and that fundamentally betrayed our #Values and moral standing in the world.","","2","8"
"Delaney","Delaney_office","1022552425893388289","2018-07-26 18:41:11","Today is the court-ordered deadline for the Trump Administration to #ReuniteEveryChild that's been detailed w/ their parents. It's widely reported the Administration won't meet this deadline, in part because hundreds of parents have already been deported without their children.","","5","11"
"Delaney","Delaney_office","1022525364902547457","2018-07-26 16:53:39","RT @AICaucus: Interesting panel hosted by @actonline regarding the applicability of AI in healthcare. Thanks to AI Caucus co-chair @RepPete…","","4","0"
"Delaney","Delaney_office","1022512076961538050","2018-07-26 16:00:51","Delaney, Budd, Markey, Sasse, Introduce Bipartisan, Bicameral Legislation to Study Impact of Technology and Media on Children https://t.co/rKQ6s8LfUX","","6","22"
"Delaney","Delaney_office","1022482995373121536","2018-07-26 14:05:17","RT @StevenOverly: First in @MorningTech: @SenMarkey and @RepJohnDelaney will introduce their bill today for NIH to study the effects of pro…","","3","0"
"Delaney","Delaney_office","1022113733227806721","2018-07-25 13:37:58","RT @billingspg: Great Bipartisan letter from the entire delegation urging @EPAAWheeler to protect Marylanders from out of state air polluti…","","4","0"
"Delaney","Delaney_office","1021828045785710592","2018-07-24 18:42:45","The most effective way to combat climate change is to put a price on carbon. My floor speech: https://t.co/hc9Xn6HM6v","","1","6"
"Delaney","Delaney_office","1021468442254340102","2018-07-23 18:53:49","Trade wars are not good and they are not easy to win. https://t.co/57iLvUSHUl","","4","13"
"Delaney","Delaney_office","1021393274886647808","2018-07-23 13:55:07","The House is in session this week. Here's what we're scheduled to vote on: https://t.co/1WrnfgsBk3","","3","0"
"Delaney","Delaney_office","1020320223340171267","2018-07-20 14:51:12","RT @ABC7News: Maryland congressmen introduce bill to block foreign ownership of election systems
@RepJohnDelaney @RepAndyHarrisMD 
https://…","","19","0"
"Delaney","Delaney_office","1020013900853628928","2018-07-19 18:33:59","Delaney, Harris Introduce Bipartisan Legislation to Protect Elections Systems from Foreign Ownership and Control  https://t.co/Xmn65uvjvT","","12","24"
"Delaney","Delaney_office","1019983440840724480","2018-07-19 16:32:57","Today, I voted against a House Republican resolution attacking the idea of a #CarbonTax. Putting a price on carbon is one of the most effective tools we have, which is why I went to the floor to speak out against the latest effort to deny #climate #Science and block #innovation. https://t.co/L7fpHc92j8","","12","42"
"Delaney","Delaney_office","1019600143262330881","2018-07-18 15:09:52","RT @HouseNewDems: 170 years ago, July 1848, women at the Seneca Falls Convention pledged to fight for women’s right to vote. Today in 2018,…","","5","0"
"Delaney","Delaney_office","1019567057820639233","2018-07-18 12:58:23","RT @jefferyrlsmith: Just heard a refreshingly brief and insightful contextualization of #AI from AI Caucus Co-Chair @RepJohnDelaney. Well d…","","3","0"
"Delaney","Delaney_office","1019179054254223360","2018-07-17 11:16:36","Our election systems are targets of attacks, and we must take steps to harden and protect our democratic institutions. The integrity and security of our elections transcends partisanship and I thank Congressman Andy Harris for working with me on this important legislation.","","6","24"
"Delaney","Delaney_office","1019179052597436417","2018-07-17 11:16:36","It’s alarming that so much of our elections systems could be controlled by foreign-owned entities. This legislation will prevent this from happening again.","","7","23"
"Delaney","Delaney_office","1019179050751922177","2018-07-17 11:16:35","Last week the FBI informed MD officials that a firm used by the state for voter registration, election night results etc has ties to a Russian oligarch close to Putin. I'm introducing legislation to block foreign ownership &amp; control of election systems. https://t.co/WUgDyTsyWF","","35","81"
"Delaney","Delaney_office","1019176710753964034","2018-07-17 11:07:17","The House is in session this week. Here's a list of the bills the Speaker is bringing to the floor for a vote https://t.co/oDUOI6jLEW","","5","1"
"Delaney","Delaney_office","1019035988671254528","2018-07-17 01:48:07","Instead of defending our nation, our intelligence community, and our democracy our Commander-in-Chief sided with the leader of the nation who attacked America’s electoral process. https://t.co/eRYM0uETcM","","21","44"
"Delaney","Delaney_office","1018971621443416065","2018-07-16 21:32:20",".@RepJohnDelaney &amp; @repandyharrismd to File Bipartisan Legislation to Block Foreign Ownership and Control of U.S. Election Systems https://t.co/WUgDyTsyWF","","18","29"
"Delaney","Delaney_office","1018970316993900545","2018-07-16 21:27:09","Delaney Statement on President Trump’s Remarks in Helsinki https://t.co/eRYM0uETcM https://t.co/9lpEie5uuE","","20","32"
"Delaney","Delaney_office","1017874672778727425","2018-07-13 20:53:27","Not a witch hunt
https://t.co/8MBzSaSdGO","","6","16"
"Delaney","Delaney_office","1017468376665477122","2018-07-12 17:58:59","But those disagreements and the battle of different ideas should strengthen us. They should never lead to personal and inappropriate attacks like this, especially with our allies. If we do that, we lose everything.","","1","4"
"Delaney","Delaney_office","1017468375839182848","2018-07-12 17:58:59","He has seen what terrorism can do firsthand, so to call him that is unacceptable and just plain wrong. We are given an amazing privilege to serve the public and should do so with civility and dignity. I encourage all elected officials to engage in civil and respectful debate...","","1","4"
"Delaney","Delaney_office","1017468374970982400","2018-07-12 17:58:58","I was truly shocked to see Mayor Bruchey's comments about London's Mayor, Sadiq Khan. Mayor Khan is global advocate for equality and has guided his city through numerous actual terrorist attacks with strength and class.","","5","7"
"Delaney","Delaney_office","1017127513447858177","2018-07-11 19:24:31","RT @FCPSMDSuper: Advocating on Capital Hill, our first visit is with Rep. John Delaney. Appreciate his support and vision for public educat…","","1","0"
"Delaney","Delaney_office","1017125687336022017","2018-07-11 19:17:15","Today, the #Maryland delegation observed a moment of silence on the House floor for the victims of the #CapitalGazette shooting in #Annapolis. Since December 14, 2012, it's the 49th time we've done so due to gun violence.

THE. FORTY. NINTH. TIME. #EnoughIsEnough #NeverAgain https://t.co/Z5oM5RSrqY","","10","13"
