"Delaney","Delaney_office","672486302382759937","2015-12-03 18:43:23","30 sign on to Delaney letter calling for more resources to be dedicated to refugee resettlement https://t.co/uvipFsbGPi","","1","1"
"Delaney","Delaney_office","672485574385733633","2015-12-03 18:40:29","Delaney Leads Letter Calling for Increased Funding for Refugee Screening and Resettlement https://t.co/uvipFsbGPi","","1","0"
"Delaney","Delaney_office","672170540887592961","2015-12-02 21:48:39","I’m saddened by yet another mass shooting. My prayers are with the San Bernardino community.","","0","1"
"Delaney","Delaney_office","672116771420282881","2015-12-02 18:15:00","Spoke w/ @NewsChannel8 about our #infrastructure crisis, climate change and the need for a clean govt funding bill https://t.co/qxKuts3t7m","","1","0"
"Delaney","Delaney_office","671826387657957376","2015-12-01 23:01:07","VIDEO: It's time for Congress to address climate change. Watch my floor speech here https://t.co/xacpMHZ4q8","","1","2"
"Delaney","Delaney_office","671810704060600320","2015-12-01 21:58:48","Pleased that @POTUS voiced support for a market-based solution to #climatechange. My bill: https://t.co/enzFNfsa4J","","2","0"
"Delaney","Delaney_office","671776442322132993","2015-12-01 19:42:39","""You must never be fearful of what you are doing when it is right."" -- Rosa Parks | 60 years ago today, she changed America for the better","","2","0"
"Delaney","Delaney_office","671751999940124672","2015-12-01 18:05:31","RT @repjohnlewis: The actions of Rosa Parks on this day 60 years ago ushered in a nonviolent revolution. #goodtrouble https://t.co/t4wBqA03…","","2590","0"
"Delaney","Delaney_office","671726511767093248","2015-12-01 16:24:15","Stay up to date on events my office is holding in your area by subscribing to my e-newsletter https://t.co/EhJtbIzO3M","","0","0"
"Delaney","Delaney_office","671348072207749120","2015-11-30 15:20:28","The House is in session this week. Here's what we're scheduled to vote on:  https://t.co/oM5WQ1HsgP","","0","0"
"Delaney","Delaney_office","670439534270763008","2015-11-28 03:10:15","My thoughts and prayers are with all of the victims and their families in Colorado Springs.","","1","3"
"Delaney","Delaney_office","670021201759248385","2015-11-26 23:27:57","Happy Thanksgiving!","","1","2"
"Delaney","Delaney_office","670020163023060992","2015-11-26 23:23:49","RT @Your4State: Community raises money while running in annual Turkey Trot #MD 
https://t.co/fjcLjjluHD","","1","0"
"Delaney","Delaney_office","670019449278304257","2015-11-26 23:20:59","Thank you! https://t.co/ncEt2PPS4A","","2","1"
"Delaney","Delaney_office","668845877612662786","2015-11-23 17:37:38","Thanksgiving tips: https://t.co/x9jS9K89uS","","2","0"
"Delaney","Delaney_office","667100711554011136","2015-11-18 22:02:58","Glad to see progress on legislation to replace No Child Left Behind.  We must ensure our kids have access to high quality public education.","","3","2"
"Delaney","Delaney_office","666745207392772097","2015-11-17 22:30:19","Congratulations to @SenatorBarb on being named a recipient of the Presidential Medal of Freedom. I am proud to serve with her.","","0","2"
"Delaney","Delaney_office","665296238846320640","2015-11-13 22:32:38","Horrific news coming out of Paris. The United States stands strong with our French brothers and sisters.","","3","5"
"Delaney","Delaney_office","664854770180620289","2015-11-12 17:18:24","One of Maryland’s own, US Army Captain Florent Groberg (Ret.) was awarded the Medal of Honor today due to his heroism on the battlefield.","","0","3"
"Delaney","Delaney_office","664580937611481088","2015-11-11 23:10:17","RT @ServingTogether: Words of thanks for our #veterans from @RepJohnDelaney #VeteransDay2015 @GburgMD ceremony https://t.co/jxWbscxEiP","","2","0"
"Delaney","Delaney_office","664510247218860032","2015-11-11 18:29:23","As a country, we come together on #VeteransDay to thank those who answered the call of duty https://t.co/NLNx5awJhD","","2","1"
"Delaney","Delaney_office","664509281711075328","2015-11-11 18:25:33","Read my full #VeteransDay statement here https://t.co/NLNx5awJhD","","1","1"
"Delaney","Delaney_office","664435164429328384","2015-11-11 13:31:02","Today we join together to honor veterans of our Armed Forces and thank them for their dedication and service to our country.","","5","5"
"Delaney","Delaney_office","664137255632674816","2015-11-10 17:47:15","Happy 240th birthday to the Marine Corps! To all active and former Marines, thank you for your dedication and service to the United States.","","0","2"
"Delaney","Delaney_office","663795604598988800","2015-11-09 19:09:39","I will be introducing legislation that will make it easier for veterans to take medical leave: https://t.co/wWsGlq4LZA","","0","1"
"Delaney","Delaney_office","663378455556448256","2015-11-08 15:32:03","Looking forward to today's #VeteransDay observance in Brunswick.","","0","0"
"Delaney","Delaney_office","662733974859460608","2015-11-06 20:51:07","I joined my colleagues in calling for an end to incendiary rhetoric by PA President Abbas: https://t.co/5DpNCqbEAb","","0","0"
"Delaney","Delaney_office","662727951620792320","2015-11-06 20:27:11","Delaney urges President Abbas to publicly repudiate Palestinian attacks https://t.co/5DpNCqbEAb","","0","0"
"Delaney","Delaney_office","662304387474325504","2015-11-05 16:24:05","RT @BGOV: Infrastructure isn't an expense, it's an investment (and a strong investment) says @RepJohnDelaney at #BGOVBuild https://t.co/FKd…","","10","0"
"Delaney","Delaney_office","662291638526586881","2015-11-05 15:33:26","RT @BAFuture: .@RepJohnDelaney: Stop thinking of infrastructure spending as an expense... think of it as an investment. #BGOVBuild","","1","0"
"Delaney","Delaney_office","662291564396441600","2015-11-05 15:33:08","RT @BAFuture: .@RepRichardHanna @RepJohnDelaney &amp; @SenJohnHoeven join @BAFuture and @BGOV to talk infrastructure investment https://t.co/JK…","","3","0"
"Delaney","Delaney_office","662015878586884096","2015-11-04 21:17:39","Congressman Delaney spoke on the House floor today against the underfunded Surface Transportation bill:
https://t.co/792quxd154","","0","1"
"Delaney","Delaney_office","661646378658095104","2015-11-03 20:49:24","Secretary Vilsack and I answering questions after my Agricultural Workshop in Boonsboro https://t.co/x7gNpe34R4","","0","2"
"Delaney","Delaney_office","661271577816899585","2015-11-02 20:00:04","Thank you @USDA for joining me in Maryland's 6th District to talk agriculture, jobs, trade, and the economy. https://t.co/Cld5Bd6TXB","","1","1"
"Delaney","Delaney_office","659371510394658816","2015-10-28 14:09:53","Read my full statement on the 35th short-term highway patch of the last decade https://t.co/dZECimoeZu #RebuildRenew #badpolicy","","0","2"
"Delaney","Delaney_office","659097150807261185","2015-10-27 19:59:40","Instead of patching the same flat tire for a decade, it’s time for a new approach  https://t.co/dZECimoeZu #FixTheTrustFund","","2","1"
"Delaney","Delaney_office","659096665710817280","2015-10-27 19:57:45","Delaney Statement on Short-Term Highway Patch  https://t.co/dZECimoeZu #FixTheTrustFund","","1","0"
"Delaney","Delaney_office","659067527272771584","2015-10-27 18:01:58","House just passed another short-term highway patch. Time for a long-term solution, time for Infrastructure 2.0 https://t.co/B8Tlz6Akn0","","5","3"
"Delaney","Delaney_office","659041170362880000","2015-10-27 16:17:14","Thank you @RepBarbaraLee for cosponsoring the Early Learning Act, bill establishing access to free pre-k for all https://t.co/P9AAZqiKWn","","0","2"
"Delaney","Delaney_office","658990268201443328","2015-10-27 12:54:58","Honored to bring the nation's top agriculture official to Western Maryland https://t.co/0n4TZkvfC9","","0","0"
"Delaney","Delaney_office","658743858310811648","2015-10-26 20:35:49","The House is in session this week, here's what we're scheduled to vote on https://t.co/aSi0E5KHco","","2","2"
"Delaney","Delaney_office","658645308956540929","2015-10-26 14:04:13","Delaney to Hold Ag. Workshop with U.S. Secretary of Agriculture Tom Vilsack  https://t.co/0n4TZkMQtH","","1","0"
"Delaney","Delaney_office","657955750820651008","2015-10-24 16:24:09","Scam artists operating in MD &amp; neighboring states | Marshals search for fugitives involved in construction scams https://t.co/6FwbO6Ud2U","","0","0"
"Delaney","Delaney_office","657654882388832257","2015-10-23 20:28:37","Thank you to @RepJudyChu for cosponsoring the Early Learning Act, legislation to establish nationwide pre-k. https://t.co/P9AAZqiKWn","","0","0"
"Delaney","Delaney_office","657602825090965506","2015-10-23 17:01:45","Delaney to Hold Ag. Workshop with U.S. Secretary of Agriculture Tom Vilsack  in Boonsboro https://t.co/0n4TZkvfC9","","1","1"
"Delaney","Delaney_office","657589882911629313","2015-10-23 16:10:20","Just left the House floor, where I voted AGAINST yet another partisan bill to repeal the Affordable Care Act","","1","2"
"Delaney","Delaney_office","657261945721110529","2015-10-22 18:27:13","Baseline-Level House Highway Bill Not Enough to Rebuild America or Compete Globally https://t.co/qloyoR5O6X","","0","1"
"Delaney","Delaney_office","657192305196158976","2015-10-22 13:50:30","To start making a dent in our infrastructure deficit, we should be investing 10-20% more, not flatlining https://t.co/Pr9r4LyBMc","","1","1"
"Delaney","Delaney_office","657192124211974144","2015-10-22 13:49:47","T&amp;I Committee marking up Highway Bill that keeps investment in #infrastructure flat. To improve D+ infrastructure, we have to do more.","","0","0"
"Delaney","Delaney_office","656846131872296960","2015-10-21 14:54:56","RT @repdonnaedwards: Glad to join in creating nationwide access 2 free pre-K for 4-year-old children. Access 2 education is an equalizer! h…","","5","0"
"Delaney","Delaney_office","656832651765108736","2015-10-21 14:01:22","Thank you @repdonnaedwards for cosponsoring the Early Learning Act, establishing pre-k for all! Bill info here: https://t.co/P9AAZqiKWn","","2","0"
"Delaney","Delaney_office","656495776219156480","2015-10-20 15:42:44","Extreme weather and increased natural disasters are literally a bad business climate https://t.co/dnPvnGBXEk","","2","2"
"Delaney","Delaney_office","656493588088496129","2015-10-20 15:34:03","@HPhelps4 thx for asking. The bill has been sent to the Judiciary Committee, now has 11 cosponsors in the House","","0","0"
"Delaney","Delaney_office","656457733898674176","2015-10-20 13:11:34","Headed to Washington County. Busy day in Hagerstown before coming back to the Capitol for votes.","","1","1"
"Delaney","Delaney_office","656188703832973314","2015-10-19 19:22:33","Delaney Applauds Commitments to American Business Act on Climate Pledge https://t.co/dnPvnGBXEk","","1","3"
"Delaney","Delaney_office","656173079111073793","2015-10-19 18:20:27","As the T&amp;I Committee prepares to markup a new highway bill, we must make sure we're increasing investment https://t.co/Pr9r4LyBMc","","1","0"
"Delaney","Delaney_office","656104614262099968","2015-10-19 13:48:24","The House is in session this week. Here's what we're scheduled to vote on: http://t.co/WwcQJ9RGqQ","","0","0"
"Delaney","Delaney_office","656103971354976256","2015-10-19 13:45:51","RT @Transport: #OnThisDay in 1914, Congress approved establishment of the 1st U.S. gov owned motor vehicles used to pick up mail. http://t.…","","4","0"
"Delaney","Delaney_office","655109117728694272","2015-10-16 19:52:39","House marking up Highway Bill next week, maintaining inadequate funding for roads &amp; bridges isn't good enough http://t.co/Pr9r4LyBMc","","0","1"
"Delaney","Delaney_office","655087878196871168","2015-10-16 18:28:15","Unfortunately keeps coming up, but any form of debt prioritization is a bad idea, borderline fiscally illiterate http://t.co/IsKsbeT6A3","","2","0"
"Delaney","Delaney_office","655081190517555200","2015-10-16 18:01:41","Over 80 attended our Seniors Workshop yesterday in Urbana http://t.co/jQeV5Y29Id","","1","0"
"Delaney","Delaney_office","655058515657101314","2015-10-16 16:31:35","Team Maryland is united: MD is the best site for the new FBI HQ. Close proximity to Capitol, metro, edu, research hubs #FBI2MD","","6","3"
"Delaney","Delaney_office","655053547764097028","2015-10-16 16:11:50","Bringing #FBI2MD = jobs &amp; economic development, a stronger Maryland economy","","6","3"
"Delaney","Delaney_office","655021626023628800","2015-10-16 14:05:00","Thank you https://t.co/KdCz6pBrQj","","1","0"
"Delaney","Delaney_office","655013383746514944","2015-10-16 13:32:14","Delaney Office Holds Seniors Workshop in Urbana  http://t.co/jQeV5Y29Id","","0","0"
"Delaney","Delaney_office","654710910418747393","2015-10-15 17:30:19","Dem presses for 'meaningful increase' in road spending http://t.co/ooOziVqfC1","","5","1"
"Delaney","Delaney_office","654670326278713345","2015-10-15 14:49:03","Instead of continuing our path to a 3rd-world infrastructure, next highway bill should start our infra comeback http://t.co/KzLwwiX5OO","","4","0"
"Delaney","Delaney_office","654669846160891904","2015-10-15 14:47:09","Delaney to Transportation Chairman: New Highway Bill Must Increase Infrastructure Investment http://t.co/Pr9r4Lh0nC","","1","1"
"Delaney","Delaney_office","654351022383624194","2015-10-14 17:40:15","The potential consequences of #climatechange are staggering and we have to respond. Watch my floor speech here https://t.co/xacpMHZ4q8","","4","1"
"Delaney","Delaney_office","654297512396898304","2015-10-14 14:07:37","Good insight from @BillGates on the need to invest in research and implement a carbon tax http://t.co/xJY6Jthwq9","","4","2"
"Delaney","Delaney_office","654291302138445825","2015-10-14 13:42:57","Need help with Social Security? My office is here for you: http://t.co/jcZJA9AVmC","","1","0"
"Delaney","Delaney_office","654287159826980864","2015-10-14 13:26:29","RT @RepBradAshford: Infrastructure 2.0 Act spurs ag, construction, manufacturing sectors + creates jobs w/o raising taxes #FixOurRoads http…","","5","0"
"Delaney","Delaney_office","654127396107501568","2015-10-14 02:51:38","Let's give every kid in America access to pre-k http://t.co/P9AAZqiKWn","","1","1"
"Delaney","Delaney_office","653925520514654208","2015-10-13 13:29:28","Happy 240th Birthday to the United States Navy! http://t.co/YH98KCDcwV","","0","1"
"Delaney","Delaney_office","653922131894534144","2015-10-13 13:16:00","RT @CyberMaryland: Congressman John Delaney set to address #cyber leaders during CyberMaryland's opening session, 10/28 @RepJohnDelaney htt…","","4","0"
"Delaney","Delaney_office","652543257394737152","2015-10-09 17:56:50","House Passes Delaney Clean Energy Amendment to Oil Export Bill  http://t.co/Umj1XEjzLc","","3","1"
"Delaney","Delaney_office","652533911256465408","2015-10-09 17:19:42","Floor Debate on Rep. Delaney's Clean Energy Amendment https://t.co/hI7U8pN97b via @YouTube","","0","0"
"Delaney","Delaney_office","652533781094662144","2015-10-09 17:19:11","RT @RepCurbelo: Offered amendment w/@RepJohnDelaney @RepChrisGibson recognizing country's progress in reducing crude oil consumption https:…","","5","0"
"Delaney","Delaney_office","652510303272456192","2015-10-09 15:45:54","Thank you to @RepCurbelo &amp; @RepChrisGibson for working with me on our clean energy amendment","","2","3"
"Delaney","Delaney_office","652507870110580740","2015-10-09 15:36:13","Speaking NOW on the House floor http://t.co/t9JSAfibba","","0","1"
"Delaney","Delaney_office","652505781242359808","2015-10-09 15:27:55","In approx 10 min I'll be speaking on the House floor on the importance of developing clean energy. Watch here: http://t.co/t9JSAfibba","","4","1"
"Delaney","Delaney_office","652498402832424960","2015-10-09 14:58:36","Headed to the floor to speak on my clean energy amendment to today's oil exports bill.","","0","0"
"Delaney","Delaney_office","652487138148265984","2015-10-09 14:13:51","Just signed the #dischargepetition to bring the re authorization of the Ex-Im Bank to the floor for a vote. #ExIm4Jobs","","2","7"
"Delaney","Delaney_office","652486773524836352","2015-10-09 14:12:24","RT @LCAorg: Thanks @RepJohnDelaney office for attending our #lungcancer Congressional Briefing this morning! #lcsm","","1","0"
"Delaney","Delaney_office","652182856836476928","2015-10-08 18:04:44","Let's stay in touch. Click here to subscribe to my e-newsletter https://t.co/3OUuzo4diw","","1","0"
"Delaney","Delaney_office","652182605069176832","2015-10-08 18:03:44","@iwilson4591_ike @pawlap yes, I'm a cosponsor of HR1217, establishes univ. background checks, improves coord. between law enf agencies","","1","1"
"Delaney","Delaney_office","652182439545184256","2015-10-08 18:03:05","@pnyrdr @KristinGCook yes, I'm a cosponsor of HR1217, establishes univ. background checks, improves coord. between law enforcement agencies","","1","2"
"Delaney","Delaney_office","652182131205083136","2015-10-08 18:01:51","@JormaTakala @norij_MD  @amitarene  I'm a cosponsor of bill establishing univ. background checks, improved coord. between law enforcement","","1","1"
"Delaney","Delaney_office","652144591731224581","2015-10-08 15:32:41","Thank you to @RepAdams for cosponsoring my pre-k for all bill. Honored to have an educator supporting the Early Learning Act","","0","1"
"Delaney","Delaney_office","652142862667157504","2015-10-08 15:25:49","@vdgaines I'm a cosponsor of HR 1217, establishes universal background checks, improves coordination between law enforcement agencies","","1","2"
"Delaney","Delaney_office","652137022434361344","2015-10-08 15:02:36","My office is holding a Srs Workshop next week in Urbana. Representatives from S.Security &amp; Medicare will attend http://t.co/wvqhPz04W7","","0","0"
"Delaney","Delaney_office","651864137698557952","2015-10-07 20:58:16",".@RepRichardHanna &amp; I wrote to Leader McCarthy urging him to bring int tax reform/6-yr hwy bill to the floor http://t.co/GFs7VBVwlY","","0","1"
"Delaney","Delaney_office","651845723860897792","2015-10-07 19:45:05","Delaney, Hanna Urge House Majority Leader to Bring Infrastructure &amp; Tax Reform Package to the Floor  http://t.co/GFs7VBVwlY","","3","2"
"Delaney","Delaney_office","651760787162312704","2015-10-07 14:07:35","RT @_BrightFocus: Thanks to Congressman Delaney @RepJohnDelaney and those who came to see him at BrightFocus yesterday. http://t.co/AtwMDpr…","","4","0"
"Delaney","Delaney_office","651747904470822912","2015-10-07 13:16:23","22 days until the #HighwayTrustFund expires. Time for Infrastructure 2.0 http://t.co/B8Tlz6Akn0 #FixtheFund","","1","3"
"Delaney","Delaney_office","651480706858766336","2015-10-06 19:34:39","My Infrastructure 2.0 Act uses international tax reform to fund a 6-yr Highway Bill, has strong bipartisan support http://t.co/B8Tlz6Akn0","","2","0"
"Delaney","Delaney_office","651479302492565505","2015-10-06 19:29:04","Met with hundreds of colleagues and know that support is there for big &amp; bold deal on infrastructure + int tax reform. Let's get it done.","","0","1"
"Delaney","Delaney_office","651435312158261248","2015-10-06 16:34:16","The House is in session this week. Here's what we're scheduled to vote on:  http://t.co/ETC14EzXxQ","","1","0"
"Delaney","Delaney_office","651357835897516032","2015-10-06 11:26:24","I'll be holding office hours today in #Clarksburg.  Information here http://t.co/RXlH9FNJzi","","2","0"
"Delaney","Delaney_office","651071289931771904","2015-10-05 16:27:46","Was  honored to take part in the Silver Star Medal Award Ceremony for Irvin W. 'Butch' Johnson of Cumberland http://t.co/rKnanXEGc8","","2","1"
"Delaney","Delaney_office","651067768729640960","2015-10-05 16:13:46","Delaney Meets with Constituents One-on-One During Office Hours in Frostburg  http://t.co/Io2wEfDX99","","0","0"
"Delaney","Delaney_office","651031753004613632","2015-10-05 13:50:40","I'll be holding office hours tomorrow in #Clarksburg Info here: http://t.co/RXlH9FNJzi","","1","0"
"Delaney","Delaney_office","650845291722186752","2015-10-05 01:29:44","Big crowd of over 40 for office hours today in Frostburg. Thank you to everyone who took time out of their day to speak with me.","","3","0"
"Delaney","Delaney_office","650484152303812608","2015-10-04 01:34:41","I'll be holding office hours tomorrow in Frostburg. Info here: http://t.co/Y4epsNfay7","","2","1"
"Delaney","Delaney_office","650004962014035968","2015-10-02 17:50:34","@Allenmattison I support that legislation","","0","0"
"Delaney","Delaney_office","650004619628802048","2015-10-02 17:49:12","I'll be holding office hours Sunday in #Frostburg. Info here: http://t.co/xnX38kdZ6h","","2","2"
"Delaney","Delaney_office","649937117066448897","2015-10-02 13:20:58","Thank you to @RepMikeHonda for cosponsoring the Early Learning Act, establishing national pre-k for all","","1","2"
"Delaney","Delaney_office","649675242407895040","2015-10-01 20:00:22","My prayers are with UCC on this heartbreaking day. The horror of gun violence must stop and we must take action to keep people safe.","","1","3"
"Delaney","Delaney_office","649639443436052481","2015-10-01 17:38:07","RT @MobileLabCoal: We need to engage more people in #stem fields for the economy and for doing good! @RepJohnDelaney #mobilestem http://t.c…","","1","0"
"Delaney","Delaney_office","649639311722348544","2015-10-01 17:37:36","RT @MdBioFoundation: @RepJohnDelaney discusses the impact that stem education has on students #stemed #mobilestem http://t.co/OJlWz4nA4i","","1","0"
"Delaney","Delaney_office","649637808110469120","2015-10-01 17:31:37","RT @MDMEMA: We continue to work w @NWS to monitor #Joaquin. We are also preparing for heavy rainfall &amp; flooding for parts of MD. http://t.c…","","10","0"
"Delaney","Delaney_office","649637266307031040","2015-10-01 17:29:28","RT @nbcwashington: See list of football games, events cancelled or modified due to #Joaquin's approach  http://t.co/fkCaujFj9Z http://t.co/…","","15","0"
"Delaney","Delaney_office","649578536504815617","2015-10-01 13:36:06","RT @Krz10Piston: @RepJohnDelaney Thanks for cosponsoring H.R. 1786 and standing up to help sick and injured 9/11 responders! #renew911health","","2","0"
"Delaney","Delaney_office","649332620212457472","2015-09-30 21:18:55","Just voted to avoid a government shutdown. Measure passed with bipartisan support, 277-151. Govt funded until December","","3","6"
"Delaney","Delaney_office","649325345594867712","2015-09-30 20:50:00","Thank you to @keithellison for cosponsoring the Early Learning Act, my legislation providing every 4-yr-old access to pre-k.","","10","18"
"Delaney","Delaney_office","649264328282144769","2015-09-30 16:47:33","Thank you to @RepCorrineBrown for cosponsoring the Early Learning Act, establishing nationwide prek for all!","","0","1"
"Delaney","Delaney_office","649212115526524928","2015-09-30 13:20:04","RT @matheeli: Here are @RepJohnDelaney's comments on our National Blue Ribbon award! http://t.co/jgq6KSpxsd @MichaelChilcutt","","1","0"
"Delaney","Delaney_office","648985773140799492","2015-09-29 22:20:40","Proud to have @EleanorNorton sign on as a cosponsor of my pre-k for all bill. http://t.co/P9AAZqiKWn","","0","2"
"Delaney","Delaney_office","648948112858447873","2015-09-29 19:51:01","Thank you @JacksonLeeTX18 for cosponsoring the Early Learning Act and supporting #prek for all http://t.co/R9A9nvfKlS","","4","1"
"Delaney","Delaney_office","648942249905115136","2015-09-29 19:27:43","Wrote to my colleagues urging them to support my #prek for all bill http://t.co/R9A9nvfKlS","","1","0"
"Delaney","Delaney_office","648927072145002496","2015-09-29 18:27:25","Holding two office hours in the next week, Frostburg on 10/4, http://t.co/Y4epsNfay7 Clarksburg on 10/6 http://t.co/RXlH9FNJzi","","0","0"
"Delaney","Delaney_office","648921930955923456","2015-09-29 18:06:59","Delaney Joins Colleagues on Legislation to Protect Federal Employees from Potential Shutdown http://t.co/8qOHQyjQA7","","4","1"
"Delaney","Delaney_office","648895200698437633","2015-09-29 16:20:46","@MFPYoung yes, another fantastic MD school!","","0","0"
"Delaney","Delaney_office","648894261488918529","2015-09-29 16:17:02","Proud to cosponsor legis by @RepDonBeyer that would ensure federal workers furloughed by a #governmentshutdown would still receive pay","","2","2"
"Delaney","Delaney_office","648890034792341504","2015-09-29 16:00:14","#nationalblueribbon #excellence  https://t.co/vsOXaVfs0Z","","0","0"
"Delaney","Delaney_office","648885020241870848","2015-09-29 15:40:19","Delaney Congratulates Smithsburg High School on Being Named a National Blue Ribbon School http://t.co/i1FXeyBUBt","","0","0"
"Delaney","Delaney_office","648884778092109824","2015-09-29 15:39:21","Smithsburg High School named a National Blue Ribbon School!","","6","5"
"Delaney","Delaney_office","648545782019280896","2015-09-28 17:12:18","In Baltimore w/ @SteveCase to discuss entrepreneurship &amp; job creation, how next gen of startups can thrive http://t.co/9AVTkJXdph","","5","3"
"Delaney","Delaney_office","648531319769669632","2015-09-28 16:14:50","RT @HerbieZiskend: @RepJohnDelaney and @SteveCase talk to startups in Baltimore about job creation #RiseofRest http://t.co/UD36afk8NO","","2","0"
"Delaney","Delaney_office","648499300390060032","2015-09-28 14:07:36","Office hours stop Number 10 will be Sunday in Frostburg. Hope to see you there: http://t.co/Y4epsNfay7","","1","0"
"Delaney","Delaney_office","648497661520297984","2015-09-28 14:01:05","My next office hours session will be Sunday in #Frostburg info here http://t.co/Y4epsNfay7","","0","0"
"Delaney","Delaney_office","648491096666996736","2015-09-28 13:35:00","The House is in session this week, here's what we're scheduled to vote on:  http://t.co/hBwdch5g0I","","0","1"
