"Delaney","Delaney_office","797129489155235840","2016-11-11 17:30:54","The spirit of #VeteransDay should stay with us every day. Thank you to all veterans &amp; their families for your service &amp; sacrifice. https://t.co/O7R9QALe6Y","","3","4"
"Delaney","Delaney_office","796798923843268613","2016-11-10 19:37:21","Reborn C&amp;O Canal advisory panel sets sail https://t.co/CZDwA35psb via @HeraldMailNews","","1","0"
"Delaney","Delaney_office","795277280373276672","2016-11-06 14:50:53","Delaney Applauds Addition of Washington County to Federal Drug Trafficking Prevention Program  https://t.co/cLwQNNVAbu","","3","3"
"Delaney","Delaney_office","794548871649198081","2016-11-04 14:36:27","Enjoyed visiting Ability Prosthetics and Orthotics in Hagerstown and speaking with them about how business is going. https://t.co/7PRSeHoiCE","","3","5"
"Delaney","Delaney_office","793843631958306818","2016-11-02 15:54:05","Shocked and saddened at the deaths of two Iowa police officers. My prayers are with their families. - John","","0","3"
"Delaney","Delaney_office","793797436674306048","2016-11-02 12:50:31","Really enjoyed visiting Jamison Door in Hagerstown https://t.co/pAAuw3R8V9","","0","1"
"Delaney","Delaney_office","793462705235619840","2016-11-01 14:40:25","April and I send our condolences and prayers to everyone in Baltimore on this very sad morning.  - John","","0","5"
"Delaney","Delaney_office","793094555402993665","2016-10-31 14:17:31","Honored to attend Seneca Church's 75th Anniversary Celebration this weekend https://t.co/VOrXSIXjUm","","2","2"
"Delaney","Delaney_office","792753953607942144","2016-10-30 15:44:05","Delaney Honors Rohrersville Band, Former Director  https://t.co/AgXP81Y23v","","0","0"
"Delaney","Delaney_office","792452161221320705","2016-10-29 19:44:52","Halloween safety tips   https://t.co/MrnwQJrqfo","","1","1"
"Delaney","Delaney_office","792119634522673152","2016-10-28 21:43:32","Thrilled that the new Public Safety Training Facility is now open in Gaithersburg! https://t.co/aYJ9WYWljW","","1","2"
"Delaney","Delaney_office","791997478493163520","2016-10-28 13:38:08","We asked the federal government to add Washington County to a critical anti-drug program, and they listened https://t.co/b9xdE7tfX0","","0","1"
"Delaney","Delaney_office","791771424348307456","2016-10-27 22:39:52","Enjoyed speaking with Professor Howe's Government class today at Frederick Community College","","0","0"
"Delaney","Delaney_office","791651505132695552","2016-10-27 14:43:21","Clarksburg Premium Outlets Grand Opening. An important economic opportunity for northern Montgomery County. https://t.co/CdBUkMLnHj","","12","30"
"Delaney","Delaney_office","791092716075675650","2016-10-26 01:42:55","Congress must act to prevent the Pentagon from recouping reenlistment bonuses from our National Guard https://t.co/PlUXrA5M8v","","4","7"
"Delaney","Delaney_office","790955537164828672","2016-10-25 16:37:49","Excited to be in Hagerstown this morning for the completion of the modernization project at Holcim.","","1","4"
"Delaney","Delaney_office","790569500299104256","2016-10-24 15:03:51","Delaney Honors Rohrersville Band, Former Director  https://t.co/6NN0tjz85z","","1","1"
"Delaney","Delaney_office","789488373656391680","2016-10-21 15:27:50","Great visit to @smartbolts. Enjoyed speaking w/ their leadership team, hearing how business is going and learning more about what they do. https://t.co/nhD69FCXAY","","1","3"
"Delaney","Delaney_office","789487605196984320","2016-10-21 15:24:47","RT @SmartBolts: Excited to announce, U.S. Congressman John Delaney @RepJohnDelaney will be touring our manufacturing facilities this Friday…","","5","0"
"Delaney","Delaney_office","789487073854099456","2016-10-21 15:22:41","RT @DHSgov: This National #CyberAware Month we recognize the role individuals play in enhancing #cybersecurity https://t.co/MOgpfqS4lP","","61","0"
"Delaney","Delaney_office","789272908233334784","2016-10-21 01:11:39","Honored to be part of the celebration -&gt; Rohrersville band and former director honored for longevity https://t.co/etjWvbzx66","","0","3"
"Delaney","Delaney_office","789272649721606144","2016-10-21 01:10:38","Rohrersville band and former director honored for longevity https://t.co/hLYN3OAWcy via @HeraldMailNews","","0","0"
"Delaney","Delaney_office","789127574471475201","2016-10-20 15:34:09","Congratulations to Gail Ganeg! https://t.co/TZryz5NNdK","","0","1"
"Delaney","Delaney_office","789127071733837824","2016-10-20 15:32:09","RT @LisaPeabody5: Thanks for your incredible support @RepJohnDelaney  at member meeting. You truly get the value of research funding! @NBTS…","","2","0"
"Delaney","Delaney_office","788564636354371584","2016-10-19 02:17:14","Officials break ground on upgrades to Washington County sewage plant https://t.co/rTcn6gLZgi via @HeraldMailNews","","0","0"
"Delaney","Delaney_office","788546110948245504","2016-10-19 01:03:37","Thank you to everyone who attended our Fix I-270 Now community forum in Clarksburg tonight","","0","4"
"Delaney","Delaney_office","788382293161369601","2016-10-18 14:12:40","RT @cj_lovelace: .@RepJohnDelaney and @MDEnvironment Sec. Ben Grumbles here 4 groundbreaking of @WashingtonCoMD Conococheague WWTP upgrades…","","3","0"
"Delaney","Delaney_office","788372412895227904","2016-10-18 13:33:25","RT @MdAgDept: Fall Farm Activities Taking Place Throughout Maryland. https://t.co/jd3worXknW https://t.co/WYHlpmKxFV","","3","0"
"Delaney","Delaney_office","788370561181229057","2016-10-18 13:26:03","Delaney Lauds Addition of Washington Co. to Federal Drug Trafficking Prevention Program https://t.co/IlSNoOuiUR","","1","3"
"Delaney","Delaney_office","788058915573493760","2016-10-17 16:47:41","We requested that Washington Co be added to key drug prevention program and the federal govt listened https://t.co/IlSNoOLUjr","","0","0"
"Delaney","Delaney_office","788058681858457600","2016-10-17 16:46:45","Delaney Applauds Addition of Washington County to Federal Drug Trafficking Prevention Program https://t.co/IlSNoOLUjr","","1","1"
"Delaney","Delaney_office","788044771289927680","2016-10-17 15:51:29","1) Redistricting reform 2) Letting Indys Vote in Primaries 3) Making Election Day a Holiday. Read about my bill https://t.co/SSjLIj7E2h","","4","4"
"Delaney","Delaney_office","788042133349470208","2016-10-17 15:41:00","Enjoyed the World of Montgomery celebration this weekend at Montgomery College. https://t.co/KikzC7nfXM","","1","3"
"Delaney","Delaney_office","786925782312574977","2016-10-14 13:45:01","Delaney Joins Officials, Business Leaders in Launching Fix I-270 Now Coalition https://t.co/1vrbRETHgn","","1","2"
"Delaney","Delaney_office","786925275946835968","2016-10-14 13:43:00","RT @RepRubenGallego: #HispanicHeritageMonth isn't just about celebrating our culture, but fighting for policies that will ensure a better f…","","228","0"
"Delaney","Delaney_office","786597197563342849","2016-10-13 15:59:20","Happy Birthday to the United States Navy! Thank you to all the sailors past and present for your service. #NavyBirthday https://t.co/kiWagqwbqC","","0","5"
"Delaney","Delaney_office","786376621867487232","2016-10-13 01:22:51","RT @jjwashco: @RepJohnDelaney speaking at Thomas &amp; Son Farm awarding two businesses USDA grants. https://t.co/4bOmj2fV2R","","1","0"
"Delaney","Delaney_office","786247564366454785","2016-10-12 16:50:01","Great tour of Cycle Aviation in Hagerstown today.","","0","0"
"Delaney","Delaney_office","785891231247241216","2016-10-11 17:14:05","Hoping that all those preparing to observe Yom Kippur have a meaningful fast.","","0","4"
"Delaney","Delaney_office","785839571548377088","2016-10-11 13:48:48","Let's stay connected. Click here to subscribe to my email newsletter https://t.co/EhJtbIzO3M","","0","1"
"Delaney","Delaney_office","785837647671468032","2016-10-11 13:41:10","RT @repdonnaedwards: It’s #AdaLovelaceDay &amp; we’re celebrating women's achievements in #STEM. Who’s Ada Lovelace? Lean more here: https://t.…","","8","0"
"Delaney","Delaney_office","784435447569215489","2016-10-07 16:49:19","RT @NFFF_News: Memorial Weekend is this weekend. 1000's of firefighters are in Emmitsburg,MD to honor… https://t.co/26n0bUauIs","","16","0"
"Delaney","Delaney_office","784415316461879296","2016-10-07 15:29:19","Had a great time celebrating 100 years of the aviation industry in Hagerstown this week at Wings &amp; Wheels. https://t.co/vnyBW6GSdR","","0","2"
"Delaney","Delaney_office","784405389114769409","2016-10-07 14:49:52","Enjoyed visiting the Germantown Boys &amp; Girls Club this week and learning more about the important services they provide. https://t.co/vSteMDlt3m","","1","3"
"Delaney","Delaney_office","784390176160219136","2016-10-07 13:49:25","RT @RepScottPeters: Cosponsored @RepJohnDelaney's bipartisan #50x30 bill to make the U.S. a leader in embracing clean energy revolution.
ht…","","3","0"
"Delaney","Delaney_office","783356215459975168","2016-10-04 17:20:50","I had tough questions for the #WellsFargo CEO when he testified before the Financial Services Committee. VIDEO: https://t.co/hgBSkYC6C0","","0","4"
"Delaney","Delaney_office","782594016949010432","2016-10-02 14:52:08","Shanah Tovah to all my friends celebrating Rosh Hashanah this evening","","0","1"
"Delaney","Delaney_office","782589353801515008","2016-10-02 14:33:36","Proud to work w @RepChrisGibson on bipartisan climate change legislation. https://t.co/O1qtT0Ya2S","","2","5"
"Delaney","Delaney_office","781914564984266752","2016-09-30 17:52:14","Delaney, Gibson Introduce Legislation to Begin Bipartisan Action on Climate Change  https://t.co/O1qtT0Ya2S","","3","3"
"Delaney","Delaney_office","781541483249893376","2016-09-29 17:09:44","Terrible to see a morning commute end so tragically in NJ and I support a full federal investigation into this crash.","","1","5"
"Delaney","Delaney_office","781541408083763200","2016-09-29 17:09:26","Shocked by the awful crash this AM in Hoboken. Prayers for the victims &amp; their families.","","0","4"
"Delaney","Delaney_office","781193554563563520","2016-09-28 18:07:11","Now up to 25 cosponsors of Delaney / @RepKinzinger resolution to reaffirm #NATO alliance https://t.co/fOWLn0190j","","1","2"
"Delaney","Delaney_office","781193095408910336","2016-09-28 18:05:22","I'm leading a bipartisan effort to reaffirm the crucial NATO alliance https://t.co/fOWLn0190j","","0","2"
"Delaney","Delaney_office","781157684259225600","2016-09-28 15:44:39","I join many of you in mourning the loss of Shimon Peres. As President &amp; Prime Minister of Israel he was a key international partner. https://t.co/tUs8qiEfnF","","1","2"
"Delaney","Delaney_office","780407303237492736","2016-09-26 14:02:55","The House is in session this week. Here's what we're scheduled to vote on https://t.co/3pBVSva5eH","","0","0"
"Delaney","Delaney_office","779008188461056000","2016-09-22 17:23:20","Need help with a federal agency or securing your VA or Social Security benefits? We can help https://t.co/lQgyCfz9qJ","","2","2"
"Delaney","Delaney_office","778667971313008640","2016-09-21 18:51:25","Proud to lead this effort -&gt; New coalition wants a better ride for I-270 commuters https://t.co/g9yviNRRM2","","0","6"
"Delaney","Delaney_office","778303905046364164","2016-09-20 18:44:45","RT @MFRI_UMD: Good tip for everyone! See something? Say something! https://t.co/tzsCyn5DFq","","2","0"
"Delaney","Delaney_office","778303438266466304","2016-09-20 18:42:54","The House is in session this week. Here's a list of the bills that are scheduled to come to the floor for a vote https://t.co/LVRMtfzjKY","","1","1"
"Delaney","Delaney_office","778231602811904000","2016-09-20 13:57:27","Delaney Joins Officials, Business Leaders in Launching Fix I-270 Now Coalition https://t.co/1vrbRETHgn #fix270now","","1","2"
"Delaney","Delaney_office","777928612322435073","2016-09-19 17:53:29","Incredibly scary series of acts of terrorism over the weekend  https://t.co/DwkiB6kwUP","","1","0"
"Delaney","Delaney_office","777540490271027200","2016-09-18 16:11:13","Delaney, @RepRichardHanna call for bipartisan infrastructure + tax reform solution in Wall Street Journal https://t.co/oc087spHbM","","1","3"
"Delaney","Delaney_office","777538899199614976","2016-09-18 16:04:54","Read my letter in the WSJ on the bipartisan momentum behind combining infrastructure + international tax reform  https://t.co/oc087spHbM","","0","1"
"Delaney","Delaney_office","777537841043767296","2016-09-18 16:00:41","RT @MilitaryOfficer: Thank you for your continued support! https://t.co/eosyGrRTnu","","1","0"
"Delaney","Delaney_office","777537769920925697","2016-09-18 16:00:24","RT @Callielou2002: .@repjohndelaney Grateful for your #climate leadership, thanks for joining the bipartisan #ClimateSolutionsCaucus. https…","","1","0"
"Delaney","Delaney_office","776505526628839425","2016-09-15 19:38:38","RT @MilitaryOfficer: @RepJohnDelaney ""privilege of serving in Congress is standing up for servicemembers"". TY for your support! https://t.c…","","2","0"
"Delaney","Delaney_office","776460560640647206","2016-09-15 16:39:58","Honored to meet with Maryland members of the Military Officers Association of America today.","","0","3"
"Delaney","Delaney_office","776106635341230080","2016-09-14 17:13:35","Need help with VA or Social Security benefits? My office can help https://t.co/lQgyCfz9qJ","","0","1"
"Delaney","Delaney_office","776081893271990272","2016-09-14 15:35:16","Delaney Statement on Retirement of Atlanta Federal Reserve President Dennis Lockhart 
 https://t.co/KLmWrBVMb8","","0","1"
"Delaney","Delaney_office","775868649248845824","2016-09-14 01:27:55","Houses passes legislation cosponsored by Delaney calling for increased aid for Israel https://t.co/EhmuMJ6GIS","","0","4"
"Delaney","Delaney_office","775804779645792256","2016-09-13 21:14:07","Delaney Votes in Favor of Finalizing New Long-Term Military Partnership with Israel  https://t.co/EhmuMJ6GIS","","1","1"
"Delaney","Delaney_office","775708386268676096","2016-09-13 14:51:05","We need a financial system that works for all Americans. Read about my Consumer Protection Agenda here https://t.co/wqK6C3tKVa","","2","1"
"Delaney","Delaney_office","775494423937376256","2016-09-13 00:40:53","Delaney Votes to Expand Protections for Sexual Assault Survivors  https://t.co/7A6DpY9HDm","","2","4"
"Delaney","Delaney_office","775470893975932928","2016-09-12 23:07:23","Eid Mubarak to my friends across Maryland who are celebrating!","","1","5"
"Delaney","Delaney_office","775356051231281152","2016-09-12 15:31:02","VFW, MOAA, VVA and IAVA now support Delaney bill to protect veterans' credit scores   https://t.co/CqGL6vlJUG #MD6 #MDPolitics","","2","1"
"Delaney","Delaney_office","775355595855650816","2016-09-12 15:29:14","The House is in session this week. Here's what we're scheduled to vote on https://t.co/BAcamLGLtC","","0","0"
"Delaney","Delaney_office","775349653814534144","2016-09-12 15:05:37","RT @repdonnaedwards: #OTD in 1992, Dr Mae Jemison (@maejemison) is the 1st black woman to fly in #space on Shuttle Endeavour (STS-47). http…","","15","0"
"Delaney","Delaney_office","775329193945100289","2016-09-12 13:44:19","The House is in schedule this week, here's what we're scheduled to vote on  https://t.co/BAcamLGLtC","","1","1"
"Delaney","Delaney_office","775077319828463616","2016-09-11 21:03:27","We will never forget the losses we suffered that terrible day, nor will we forget the heroes of 9/11. https://t.co/Inly6LZhMs","","3","9"
"Delaney","Delaney_office","775076025025830913","2016-09-11 20:58:19","Placed a wreath at the 9/11 Memorial in Hagerstown today and spent time in prayer &amp; reflection. https://t.co/p5ntnXbDrg","","2","8"
"Delaney","Delaney_office","774978963722625024","2016-09-11 14:32:38","Today we remember the lives we lost and the heroes who saved others #UnitedWeStand #NeverForget15years https://t.co/bgESRLkxma","","0","9"
"Delaney","Delaney_office","774293774486962176","2016-09-09 17:09:56","Joined colleagues from both parties today at the Capitol for 9/11 Remembrance Ceremony. https://t.co/9tLWuAIJrU","","0","6"
"Delaney","Delaney_office","774256643852820482","2016-09-09 14:42:23","Joining my colleagues in both parties for 9/11 Memorial Ceremony on the steps of the Capitol","","0","5"
"Delaney","Delaney_office","774239683949780992","2016-09-09 13:34:59","The everyday financial crisis that isn't getting headlines https://t.co/wqK6C3tKVa","","0","0"
"Delaney","Delaney_office","774239244068020228","2016-09-09 13:33:15","For too many Americans it can be expensive just to spend their own money.  Read my op-ed https://t.co/wqK6C3tKVa","","0","0"
"Delaney","Delaney_office","773924160988975110","2016-09-08 16:41:13","Delaney bill would extend SBA HUBZone status for Garrett County https://t.co/jGle1WsXxH","","1","0"
"Delaney","Delaney_office","773904735820771328","2016-09-08 15:24:02","A New Consumer Protection Agenda for Working Families via @HuffPostPol","","0","1"
"Delaney","Delaney_office","773899394282360832","2016-09-08 15:02:48","Let's stay in touch, click here to subscribe to my e-newsletter https://t.co/EhJtbIzO3M","","0","1"
"Delaney","Delaney_office","773563283546791939","2016-09-07 16:47:13","Delaney Votes to Expand Protections for Sexual Assault Survivors  https://t.co/7A6DpYrj1W","","1","4"
"Delaney","Delaney_office","773169818019196929","2016-09-06 14:43:44","NEWS: Delaney Earns ‘Champion of the 50+’ Award from @AARPMD  https://t.co/IvlMP84Xrj","","0","0"
"Delaney","Delaney_office","773151080809111552","2016-09-06 13:29:16","The House is in session this week, here's what we're scheduled to vote on https://t.co/ZxEOvMw9Xn","","1","0"
"Delaney","Delaney_office","772825457259610112","2016-09-05 15:55:22","Happy #LaborDay! Let's celebrate the determination, expertise and innovation of the incredible American worker!","","2","5"
"Delaney","Delaney_office","771770323800825860","2016-09-02 18:02:38","Today we celebrate VJ Day, marking the official end to WWII. May we never forget to honor the brave heroes who fought to defend our nation.","","7","15"
"Delaney","Delaney_office","771707278558916609","2016-09-02 13:52:07","Wow @iava  @MilitaryOfficer @VFWHQ &amp; VVA have all backed our bill to protect vets' credit   https://t.co/CqGL6vlJUG #MD6 #MD06 #MDPolitics","","0","1"
"Delaney","Delaney_office","771177956576112642","2016-09-01 02:48:47","Proud to receive @AARPMD's Champion of the 50+ Award https://t.co/IvlMP7Nm2J #MD6","","2","2"
"Delaney","Delaney_office","771085629715275776","2016-08-31 20:41:54","Delaney earns 'Champion of the 50+' award by AARP Maryland https://t.co/IvlMP84Xrj","","1","4"
"Delaney","Delaney_office","770740691186180101","2016-08-30 21:51:15","RT @AARPMD: At tonight's @FrederickKeys game, we will proudly present our Leadership Award to @RepJohnDelaney for his work obo the 50+ in M…","","4","0"
"Delaney","Delaney_office","770660766362005505","2016-08-30 16:33:39","Delaney legislation to protect veterans' credit scores recieves backing from @iava  https://t.co/CqGL6vlJUG #MD6","","1","1"
"Delaney","Delaney_office","770617722476437504","2016-08-30 13:42:37","Let's stay in touch - click here to subscribe to my e-newsletter https://t.co/EhJtbIicFc","","0","1"
"Delaney","Delaney_office","770277407664242688","2016-08-29 15:10:19","Looks like there's a record-breaker in Knoxville https://t.co/d4Lda4NshU","","0","1"
"Delaney","Delaney_office","769917188534919168","2016-08-28 15:18:56","Had a great time yesterday at Augustoberfest in Hagerstown, a wonderful celebration of our area's German heritage https://t.co/8VqbMabJCH","","1","4"
"Delaney","Delaney_office","769572385192288256","2016-08-27 16:28:49","Proud to have so many veterans orgs supporting our effort to protect the credit scores of America's heroes https://t.co/fpvhY0hsT9 #MD6","","2","1"
"Delaney","Delaney_office","769212628061356033","2016-08-26 16:39:16","Proud to announce new federal support for firefighter safety training https://t.co/XjogZUSkRb","","0","1"
"Delaney","Delaney_office","769172748514000896","2016-08-26 14:00:48","Happy #WomensEqualityDay celebrating the certification of the 19th Amendment and continued push for full equality https://t.co/L23PHFudbq","","9","10"
"Delaney","Delaney_office","768816867351855104","2016-08-25 14:26:39","No veteran should have their credit wrecked by delayed VA payments. Info on my bipartisan bill w @RepHultgren https://t.co/C5Q7fBcmN4 #MD6","","6","1"
"Delaney","Delaney_office","768816216051945472","2016-08-25 14:24:04","RT @RepRaulGrijalva: You can #findyourpark all across the US! Go to https://t.co/MoW0weqEF0 &amp; help @NatlParkService celebrate 100 years. ht…","","94","0"
"Delaney","Delaney_office","768815704820752384","2016-08-25 14:22:02","RT @MontgomeryParks: Photo of the Day: #Sunset on Lake Seneca, Black Hill Regional Park (Photo: Lynette Lenz, #MoCoParks) https://t.co/Jie4…","","7","0"
"Delaney","Delaney_office","768529428989243396","2016-08-24 19:24:29","RT @TravelGov: If you are a US citizen in need of help after #ItalyEarthquake, call the Embassy at 06-4674 2944. https://t.co/3cYAndQRcj","","119","0"
"Delaney","Delaney_office","768515052752211968","2016-08-24 18:27:21","Monitoring the situation in Kabul, truly disturbing to see a place of learning attacked","","0","1"
"Delaney","Delaney_office","768480323340566528","2016-08-24 16:09:21","BREAKING - Delaney, Mikulski, Cardin, Van Hollen announce federal grant to hire firefighters in Frederick County  https://t.co/F6Rxft4pKm","","4","3"
"Delaney","Delaney_office","768478895620386816","2016-08-24 16:03:41","Prayers with the victims | Italy: 'At least 73 dead including many children' following 'apocalyptic' quake https://t.co/O2Ed8hQszc","","2","1"
"Delaney","Delaney_office","768472462334029824","2016-08-24 15:38:07","Proud to announce more than $6 million in federal funds to Frederick Co to hire new firefighters https://t.co/F6Rxft4pKm","","1","3"
"Delaney","Delaney_office","768085941479235584","2016-08-23 14:02:13","Click here to read about my Consumer Protection &amp; Community Investment Agenda https://t.co/mGNkybpmON https://t.co/ylMMbzJaB1","","1","1"
"Delaney","Delaney_office","767728210473803776","2016-08-22 14:20:43","#MarylandPride -&gt; Maryland ranks higher on the Olympic gold list than all but five countries https://t.co/FyeRjEMZzs","","10","9"
"Delaney","Delaney_office","766717961461764100","2016-08-19 19:26:21","As a former entrepreneur, I was excited to speak during today’s #MACoCon panel on social media https://t.co/qCQg0Fn1PU","","0","9"
"Delaney","Delaney_office","766717044779810819","2016-08-19 19:22:43","Stopping by the Montgomery County Booth today at #MACoCon https://t.co/MJdBVJ1iUI","","0","1"
"Delaney","Delaney_office","766716017070440448","2016-08-19 19:18:38","Meeting with folks from @WashingtonCoMD at #MACoCon https://t.co/FIiHedva0o","","0","2"
"Delaney","Delaney_office","766675375934074880","2016-08-19 16:37:08","At the Garrett County Booth at #MACoCon! https://t.co/8SurKfV9Qp","","0","0"
"Delaney","Delaney_office","766296691209363458","2016-08-18 15:32:22","On this date in 1920 the 19th Amendment was ratified, giving women the right to vote. Truly a date to celebrate! https://t.co/oflG11kKQv","","10","22"
"Delaney","Delaney_office","766262747579486208","2016-08-18 13:17:30","July was 'absolutely' Earth's hottest month ever recorded https://t.co/PuiHAEwpw5","","2","4"
"Delaney","Delaney_office","765934759226777600","2016-08-17 15:34:11","Let's stay in touch - click here to subscribe to my email newsletter https://t.co/EhJtbIzO3M","","0","1"
"Delaney","Delaney_office","765621757713809408","2016-08-16 18:50:26","No veteran should have their credit ruined by the VA. Read about my bipartisan bill to prevent this here https://t.co/C5Q7fBcmN4","","1","2"
"Delaney","Delaney_office","765219066718158848","2016-08-15 16:10:17","Click here to read about my Consumer Protection &amp; Community Investment Agenda https://t.co/f7NN9SMVMo","","0","1"
"Delaney","Delaney_office","765218945376849920","2016-08-15 16:09:48","For too many Americans there are still too many barriers to climbing the  economic ladder or starting a business https://t.co/f7NN9SMVMo","","0","1"
"Delaney","Delaney_office","765217757898084356","2016-08-15 16:05:05","Let's stay connected - click here to subscribe to my e-newsletter https://t.co/EhJtbIzO3M","","0","0"
"Delaney","Delaney_office","764889541152878593","2016-08-14 18:20:52","For decades Social Security has made our country stronger. We have to protect and preserve it https://t.co/H5gXz8OG2r","","2","3"
"Delaney","Delaney_office","764873872558714880","2016-08-14 17:18:36","Did you know the history of #SocialSecurity runs right through Cumberland MD? https://t.co/jpeeJzyYg4 #SocSec81","","1","5"
"Delaney","Delaney_office","764852393058131968","2016-08-14 15:53:15","Delaney Hosts Senior Workshop https://t.co/e8ZOQLSKRx #MD6","","0","0"
"Delaney","Delaney_office","764847380944617472","2016-08-14 15:33:20","Delaney Hosts Seniors Workshop in Hagerstown Featuring Social Security, Medicare  https://t.co/k2GS6JX8AX","","1","0"
"Delaney","Delaney_office","764134765935091712","2016-08-12 16:21:39","Social Security turns 81 this weekend and former #MD6 Rep. David Lewis was instrumental in its creation. My op-ed https://t.co/jpeeJzyYg4","","1","0"
"Delaney","Delaney_office","764092484527857664","2016-08-12 13:33:39","Delaney Hosts #MD6 Senior Workshop https://t.co/3UdXat41HR from @Your4State","","1","0"
"Delaney","Delaney_office","764091593338925056","2016-08-12 13:30:06","RT @FrederickSports: Group B of men's discus, which includes Frederick High alum Vikas Gowda, will begin shortly. He's slated to throw 16th…","","4","0"
"Delaney","Delaney_office","764090900649697280","2016-08-12 13:27:21","#MarylandPride https://t.co/AKYJdV98h1","","4","8"
