"Delaney","Delaney_office","870389248029073408","2017-06-01 21:19:02","Pulling Out of Paris Accord a Betrayal of Our Future, Abdication of American Leadership  https://t.co/zV4Fa4CU6H","","11","30"
"Delaney","Delaney_office","870343005718409216","2017-06-01 18:15:17","It's almost like there's daily, indisputable evidence something is happening... https://t.co/RuOWoHmnIw","","13","38"
"Delaney","Delaney_office","870327833222053890","2017-06-01 17:15:00","Proud to stand with LGBTQ Marylanders in supporting justice, fairness and respect for all. #PrideMonth https://t.co/IaxtWJABHM","","6","32"
"Delaney","Delaney_office","870327184040353793","2017-06-01 17:12:25","@p6e7g CNN did the right thing. We can disagree, can't stoop to that level.","","0","0"
"Delaney","Delaney_office","870321662125801472","2017-06-01 16:50:28","Let's stay in touch. Sign-up for our e-newsletter here ➡️https://t.co/EhJtbIzO3M Follow on @instagram ➡️https://t.co/nI1JKRI4zn 📱🖥️📩","","0","2"
"Delaney","Delaney_office","870303382405353473","2017-06-01 15:37:50","June is #nationaldairymonth. This June when you're enjoying ice cream or a glass of cold milk, thank a Maryland dairy farmer! https://t.co/KXl2aLgpEo","","1","4"
"Delaney","Delaney_office","870285307857555456","2017-06-01 14:26:01","Making Maryland proud! https://t.co/GbhXhwbJBW","","4","22"
"Delaney","Delaney_office","870280982129254401","2017-06-01 14:08:49","Thank you to @RepJayapal for joining the AI Caucus https://t.co/ZninZlsm2X","","0","2"
"Delaney","Delaney_office","870277219133915136","2017-06-01 13:53:52","RT @MichaelDillman: Brunswick High School graduates ready for next journey https://t.co/eMvFzlo6R8 via @frednewspost","","5","0"
"Delaney","Delaney_office","869999420292476928","2017-05-31 19:30:00","Instead of leaving the Paris Accord, we should be leading the global push for further action on climate. #ParisAgreement https://t.co/w2wLIN2Crj","","3","21"
"Delaney","Delaney_office","869957615480078336","2017-05-31 16:43:53","To even flirt with such a decision is a shocking abdication of leadership. This is pretty much the opposite of putting America first.","","3","19"
"Delaney","Delaney_office","869957395664994305","2017-05-31 16:43:00","Withdrawing from the Paris Climate Accords would put the United States on the sidelines of one of the defining issues of this century.","","6","33"
"Delaney","Delaney_office","869957257621938176","2017-05-31 16:42:27","Pulling Out of Paris Climate Accord Undermines American Leadership, Threatens Future  https://t.co/2RV7bHIkZy","","10","22"
"Delaney","Delaney_office","869565759583916032","2017-05-30 14:46:47","ICYMI my statement on the potential closing of National Biodefense Analysis and Countermeasures Center in Frederick https://t.co/P0gbm0zfgN","","3","3"
"Delaney","Delaney_office","869565059697184768","2017-05-30 14:44:00","@kraussm Call my Gaithersburg office at 301-926-0300","","0","0"
"Delaney","Delaney_office","869550585820962816","2017-05-30 13:46:29","Congratulations! ➡️ Frederick County first responders win statewide awards for service  https://t.co/uBctJbOPGM","","0","11"
"Delaney","Delaney_office","869550027882065920","2017-05-30 13:44:16","RT @JanGardnerExec: Join me in thanking our 1st responders &amp; 911 call takers for the life-saving work they do each day. https://t.co/VjGYnf…","","7","0"
"Delaney","Delaney_office","869329788577697792","2017-05-29 23:09:07","Veterans Memorial in Grantsville #MemorialDay https://t.co/C6mhXwGG4l","","2","8"
"Delaney","Delaney_office","869191617323970560","2017-05-29 14:00:05","Please take a moment today to remember those who made the ultimate sacrifice. #memorialday2017 #MD6 https://t.co/leb4Je7fH7","","4","12"
"Delaney","Delaney_office","869187803472703488","2017-05-29 13:44:55","Today we remember those that made the ultimate sacrifice for our country  https://t.co/qZjaiBFmXe #MemorialDay","","6","10"
"Delaney","Delaney_office","868864012494266368","2017-05-28 16:18:17","I spoke with the Washington Post on how the White House appears to be moving away from any kind of big bipartisan infrastructure plan https://t.co/Msf4CPS9Bh","","8","13"
"Delaney","Delaney_office","868628516279025665","2017-05-28 00:42:31","Trump's budget could hurt National Parks in Maryland. Report from the @HeraldMailNews  https://t.co/RBYwDPGJus https://t.co/poTj1dOeMf","","9","10"
"Delaney","Delaney_office","868627853050621952","2017-05-28 00:39:53","Proposed park cuts to include Tri-State treasures https://t.co/6GH7prOxr7 via @HeraldMailNews","","1","1"
"Delaney","Delaney_office","868185917839822848","2017-05-26 19:23:47","Proud to chair the AI Caucus with @RepPeteOlson https://t.co/Rmb5TGvXaU","","0","3"
"Delaney","Delaney_office","868184377536262144","2017-05-26 19:17:40","Ramadan Mubarak to everyone celebrating.","","7","28"
"Delaney","Delaney_office","868144579069054976","2017-05-26 16:39:31","I am 100% opposed to the closing of the NBACC and will fight this deeply misguided move by the Trump Administration.","","5","9"
"Delaney","Delaney_office","868144304434417664","2017-05-26 16:38:26","My Statement on Potential Closing of National Biodefense Analysis and Countermeasures Center in Frederick https://t.co/FkDDwAopAD https://t.co/7yNF72wQc3","","9","18"
"Delaney","Delaney_office","868140262748413952","2017-05-26 16:22:22","Proud to chair the AI Caucus, a bipartisan effort to start one of the most important policy discussions of the next decade https://t.co/P6YrvzClbU","","2","4"
"Delaney","Delaney_office","868122401405587456","2017-05-26 15:11:24","RT @BoonsboroHigh: We are so proud of our graduating seniors!  Best wishes! #wcpsmd #SeniorsLastDay https://t.co/4kM9fK7uJZ","","7","0"
"Delaney","Delaney_office","868118553374937088","2017-05-26 14:56:06","Rep. Delaney on the Protecting Veterans Credit Act https://t.co/OagR6mDAD3 #MD6","","0","1"
"Delaney","Delaney_office","868091822119243776","2017-05-26 13:09:53","Let's stay in touch, click here to subscribe to our e-newsletter https://t.co/EhJtbIzO3M","","1","0"
"Delaney","Delaney_office","867781662796464129","2017-05-25 16:37:25","Thank you @wwp for supporting my Protecting Veterans Credit Act. Bipartisan bill making sure vets credit scores aren't ruined by delays. https://t.co/x1MMyCqbqv","","7","15"
"Delaney","Delaney_office","867776214517166080","2017-05-25 16:15:46","Thank you to @MilitaryOfficer for supporting the Protecting Veterans Credit Act https://t.co/dRBxM9S5Jg","","4","9"
"Delaney","Delaney_office","867773389988954114","2017-05-25 16:04:33","Honored to have my bipartisan vets credit bill endorsed by VFW, American Legion, MOAA, Wounded Warrior Project, PVA  https://t.co/uG04636PiX","","17","23"
"Delaney","Delaney_office","867767074503794688","2017-05-25 15:39:27","Proud to intro bill to protect vets credit from being ruined by VA delays w @RepHultgren @RepSinema @RepWalorski  https://t.co/uG04636PiX","","1","6"
"Delaney","Delaney_office","867766609657704448","2017-05-25 15:37:36","Delaney, Hultgren, Sinema, Walorski File Bipartisan Bill to Protect Veterans Credit Ratings 
 https://t.co/uG0462Perp","","1","3"
"Delaney","Delaney_office","867735048396709888","2017-05-25 13:32:11","Making Frederick proud. Congratulations Tanya! https://t.co/vN2Wszxv9H","","0","5"
"Delaney","Delaney_office","867558216611360769","2017-05-25 01:49:31","RT @IBMpolicy: We look forward to sharing IBM’s technical expertise &amp; optimistic view of the future with the House #AI Caucus @RepJohnDelan…","","10","0"
"Delaney","Delaney_office","867558196080259073","2017-05-25 01:49:27","RT @TechFreedom: Well done to @RepJohnDelaney +@RepPeteOlson for launching the Artificial Intelligence Caucus, moving the 115th Congress in…","","3","0"
"Delaney","Delaney_office","867556713523810305","2017-05-25 01:43:33","RT @amazon_policy: As @JeffBezos said, there's no institution that wouldn't benefit from #AI. Kudos to @RepPeteOlson @RepJohnDelaney for fo…","","11","0"
"Delaney","Delaney_office","867556625879629824","2017-05-25 01:43:12","RT @jordannovet: Fascinating to talk w/ @RepJohnDelaney who's optimistic about AI/automation as he launches Congressional AI Caucus  https:…","","5","0"
"Delaney","Delaney_office","867433558587187206","2017-05-24 17:34:11","AI has the potential to be as transformative as the combustion engine or the PC. We need a new policy dialogue.  https://t.co/ZninZlsm2X https://t.co/PDeRTpiD9Y","","1","5"
"Delaney","Delaney_office","867431947953373184","2017-05-24 17:27:47","Thank you to @RepPeteOlson @RepJaredPolis @RepDerekKilmer @RepDebDingell @RepAnnaEshoo @RepAndreCarson for joining the AI Caucus! https://t.co/PXV9hX0BHK","","0","2"
"Delaney","Delaney_office","867396375016865792","2017-05-24 15:06:25","Why I founded the AI Caucus https://t.co/ZninZlsm2X https://t.co/HmXnqqRLBZ","","2","2"
"Delaney","Delaney_office","867395685464891392","2017-05-24 15:03:41","As lawmakers, our choice is to either get caught flat-footed or to proactively anticipate how things will change and work on smart policies. https://t.co/uvNpf4WW1a","","1","1"
"Delaney","Delaney_office","867394970193457153","2017-05-24 15:00:50","Proud to lead the AI Caucus w @RepPeteOlson https://t.co/ZninZlsm2X https://t.co/pduowHlEqj","","0","2"
"Delaney","Delaney_office","867384340900085760","2017-05-24 14:18:36","RT @frednewspost: #FrederickMD federal lawmakers @RepRaskin @ChrisVanHollen @RepJohnDelaney react to @realDonaldTrump #Budget2017:

https:/…","","8","0"
"Delaney","Delaney_office","867211971195797504","2017-05-24 02:53:40","Yet another problem with #TrumpBudget -&gt; hurts our long-term competitiveness, ability to innovate https://t.co/yu3u4x6VQp","","7","10"
"Delaney","Delaney_office","867208401817882624","2017-05-24 02:39:29","It would be helpful if our Governor dared to criticize the President, who is pushing an agenda that would be terrible for our economy.","","18","66"
"Delaney","Delaney_office","867208179532398593","2017-05-24 02:38:36","From Western Maryland to the Bay, this budget is disastrous for our state.  https://t.co/QouNJFyNgP https://t.co/NWJQL5x314","","16","20"
"Delaney","Delaney_office","867206586443452417","2017-05-24 02:32:16","Unbelievable. Except also very believable from this Admin. https://t.co/b0Jlpqelmf","","16","28"
"Delaney","Delaney_office","867170458365550592","2017-05-24 00:08:43","#TrumpBudget -&gt; Bad math, terrible priorities https://t.co/QouNJFyNgP https://t.co/uWqPuVMyQv","","13","20"
"Delaney","Delaney_office","867129757963620352","2017-05-23 21:26:59","The initial ‘skinny budget’ was a declaration of war on the state of Maryland and this is first shot https://t.co/qYThySgBNo https://t.co/CQF036974F","","10","11"
"Delaney","Delaney_office","867129225836408834","2017-05-23 21:24:52","This is a backwards-looking Tea Party budget that doesn’t position the country to succeed in a high-tech global economy.","","5","15"
"Delaney","Delaney_office","867129134648090631","2017-05-23 21:24:30","I am appalled by the values expressed in this budget, which will greatly harm the most vulnerable among us + reward those who least need it","","8","21"
"Delaney","Delaney_office","867129029681434624","2017-05-23 21:24:05","President Trump’s budget doesn’t help prepare our country for a better future and reflects the wrong priorities and the wrong goals.","","13","37"
"Delaney","Delaney_office","867128256574652417","2017-05-23 21:21:01","Read my full statement on the disastrous #TrumpBudget here -&gt; https://t.co/qYThySgBNo","","5","11"
"Delaney","Delaney_office","867125370167984128","2017-05-23 21:09:33","The White House is flashing red lights and green lights at the same time on infrastructure https://t.co/4MfPxyOC2j https://t.co/6gGqgiyaTR","","1","1"
"Delaney","Delaney_office","867124347345002500","2017-05-23 21:05:29","Trump’s Budget Sends Mixed Signals on Infrastructure 
 https://t.co/4MfPxyOC2j","","0","1"
"Delaney","Delaney_office","867038974832979969","2017-05-23 15:26:15","As we mourn the lives lost in Manchester, we must continue to stand w/ allies in UK and to aggressively fight terror on all fronts.","","5","12"
"Delaney","Delaney_office","866832790150578178","2017-05-23 01:46:56","Prayers for the victims in the UK, an ally we have stood with time and time again.","","3","17"
"Delaney","Delaney_office","866677706477498368","2017-05-22 15:30:41","The House is in session this week, here's what we're scheduled to vote on  https://t.co/GDtDs0g86X https://t.co/jcVgtPlrHw","","4","2"
"Delaney","Delaney_office","866300258795618306","2017-05-21 14:30:51","Three names added to the Hagerstown Circle of Achievement at Memorial Park https://t.co/PrHkqSHaFG via @HeraldMailNews","","1","2"
"Delaney","Delaney_office","866076574940106752","2017-05-20 23:42:01","Proud to be leading the effort in Congress to build bipartisan consensus on climate change https://t.co/UGlVN9ZNLZ","","7","29"
"Delaney","Delaney_office","865659656567275521","2017-05-19 20:05:19","Deeply troubling. Mueller must have the resources to conduct a independent investigation, with no obstruction or intimidation from the WH https://t.co/JyAKfr5eg8","","9","24"
"Delaney","Delaney_office","865610358769278976","2017-05-19 16:49:26","If the President is serious about infrastructure he should look to a bipartisan plan that can pass Congress https://t.co/emHRhqutOx","","7","9"
"Delaney","Delaney_office","865589148115062784","2017-05-19 15:25:09","RT @BlueStarHC: Congressman @RepJohnDelaney visited with us to learn more about our mission to serve senior veterans... #veterans https://t…","","2","0"
"Delaney","Delaney_office","865295830558887938","2017-05-18 19:59:37","Read about the resolution here: https://t.co/kE1qpuwzvY","","1","1"
"Delaney","Delaney_office","865295482406539264","2017-05-18 19:58:14","NATO is a key component of our national sec. portfolio and I've authored bipartisan legislation in the House to reaffirm our commitment https://t.co/UygY81HCTW","","6","14"
"Delaney","Delaney_office","865286276219645953","2017-05-18 19:21:39","Let's stay in touch, click here to subscribe to my e-newsletter https://t.co/EhJtbIzO3M","","0","2"
"Delaney","Delaney_office","865281985652162560","2017-05-18 19:04:36","#infrastructureweek is a reminder of how indispensable analysis by @ASCETweets is in making the case for infra https://t.co/qSDBsN8mQt","","2","0"
"Delaney","Delaney_office","865226468573536258","2017-05-18 15:23:59","RT @ThirdWayEcon: Infrastructure must be part of tax reform says @repjohndelaney at @InfraWeek event @housenewdems @BPC_Bipartisan @InfraWe…","","6","0"
"Delaney","Delaney_office","865217404632170497","2017-05-18 14:47:58","RT @BPC_Bipartisan: .@RepJohnDelaney: We at the federal level also need to help local governments have the technical support to grow. #infr…","","3","0"
"Delaney","Delaney_office","865217261228961792","2017-05-18 14:47:24","RT @WJCulleton: Energy should be a priority when discussing infrastructure at the local level - @RepJohnDelaney https://t.co/Rm3uItljHH","","4","0"
"Delaney","Delaney_office","865217092630564864","2017-05-18 14:46:44","RT @BAFuture: .@RepJohnDelaney: Collaboration is key to creating a federal infrastructure solution. #bpclive #TimeToBuild","","4","0"
"Delaney","Delaney_office","865206429430554625","2017-05-18 14:04:22","Read about my bipartisan bill w @RodneyDavis to rebuild infrastructure using international tax reform https://t.co/FW8jZT3CNd #bpcclive","","6","7"
"Delaney","Delaney_office","865201865079873536","2017-05-18 13:46:13","Looking forward to this morning's discussion on bipartisan infrastructure solutions at #bpclive https://t.co/po75o3UN3V","","4","10"
"Delaney","Delaney_office","865022811231879168","2017-05-18 01:54:44","Looking forward to this! https://t.co/2klsXEIqaB","","4","14"
"Delaney","Delaney_office","864978397746933760","2017-05-17 22:58:15","Very encouraged by appt. of Mueller as special counsel to investigate Russian coord. w Trump campaign. 1st step in getting answers we need.","","11","44"
"Delaney","Delaney_office","864968224173158401","2017-05-17 22:17:49","Sanctions are an important tool in weakening the murderous Assad Regime https://t.co/t56nAwgjY4 https://t.co/Nr0qPXNEE9","","4","3"
"Delaney","Delaney_office","864966918448590850","2017-05-17 22:12:38","Houses Passes Legislation Cosponsored by Delaney to Impose New Sanctions on Syria 
 https://t.co/t56nAwgjY4","","5","6"
"Delaney","Delaney_office","864949609986129921","2017-05-17 21:03:51","Bipartisan? Yes. Paid-for? Yep. Good for jobs? Definitely. My plan to use tax reform to rebuild US #infrastructure https://t.co/emHRhqutOx https://t.co/CvZl2nqZ89","","1","10"
"Delaney","Delaney_office","864925015711633408","2017-05-17 19:26:07","RT @HouseNewDems: #NewDem Members sent a letter to @POTUS proposing a bipartisan infrastructure package tied w/ tax reform
Full letter http…","","3","0"
"Delaney","Delaney_office","864863339024986112","2017-05-17 15:21:03","Thank you to the men and women of law enforcement that keep our communities safe. #PoliceWeek https://t.co/fRuiaYw3Gd","","0","5"
"Delaney","Delaney_office","864844352677445632","2017-05-17 14:05:36","Offering encouragement to students at Bester Elementary as they wrap up the school year. Love their enthusiasm! https://t.co/egCleTZ2hg","","1","6"
"Delaney","Delaney_office","864830372755931136","2017-05-17 13:10:03","I hope that at next year's #infrastructureweek we're celebrating a real breakthrough. Using international tax reform is the solution https://t.co/2EsbNzcFBQ","","0","5"
"Delaney","Delaney_office","864651882966511616","2017-05-17 01:20:48","Republicans of conscience must come forward and defend the rule of law and support an independent investigation led by a special prosecutor https://t.co/dA4qz93b4R","","23","55"
"Delaney","Delaney_office","864651542917459970","2017-05-17 01:19:26","Foundations of our democracy under attack https://t.co/KLK5BLxYWg","","27","46"
"Delaney","Delaney_office","864635215930699779","2017-05-17 00:14:34","The evidence is mounting hour by hour that President Trump is trying to undermine and obstruct a key FBI investigation. https://t.co/p8ThdtftBy","","33","48"
"Delaney","Delaney_office","864545769549910017","2017-05-16 18:19:08","Fantastic morning in Hagerstown w @BesterWCPS @bestercommunity. Always wonderful to see tomorrow's leaders! https://t.co/PN9BPwUmpQ","","0","3"
"Delaney","Delaney_office","864542997488308225","2017-05-16 18:08:07","RT @SIL_Baltimore: Today we hosted a Social Innovation Roundtable Lunch with our venture leaders and @RepJohnDelaney sharing insights on so…","","5","0"
"Delaney","Delaney_office","864542649939890176","2017-05-16 18:06:44","Coverage our our #saveourhubzone legislation and meeting at TDEC in Garrett County from @CumberlandTN https://t.co/oB35HK0DSN #MD6","","0","2"
"Delaney","Delaney_office","864505845064880129","2017-05-16 15:40:29","At a Town Hall, Ornella asked me to walk to school with her. Really enjoyed walking with her today and speaking with her family this AM. https://t.co/3C5x51ZZmH","","3","16"
"Delaney","Delaney_office","864498089159266304","2017-05-16 15:09:40","The House is in session this week, here's what we're scheduled to vote on: https://t.co/ncgBkPJkKI https://t.co/RxMnk7OQ1P","","4","2"
"Delaney","Delaney_office","864496825444728832","2017-05-16 15:04:39","Infrastructure pencils out and is one of the smartest investments we can make. https://t.co/Xz2BCHtgc4","","1","3"
"Delaney","Delaney_office","864495994674839552","2017-05-16 15:01:21","Aging infrastructure is holding our economy back. #TimetoBuild https://t.co/i4DzVj3d1E","","6","14"
"Delaney","Delaney_office","864477285264621569","2017-05-16 13:47:00","RT @HFDNews: FAOs O'Connell and Eckstine, and @RepJohnDelaney help escort our little friends from @BesterWCPS walk to school today https://…","","2","0"
"Delaney","Delaney_office","864245947022180352","2017-05-15 22:27:45","RT @jennaportnoy: .@RepJohnDelaney: WaPo story shows ""pure incompetence or an attempt to place Russia above our allies."" Either way, ""amazi…","","9","0"
"Delaney","Delaney_office","864236049677111297","2017-05-15 21:48:25","On this shocking Washington Post report https://t.co/PITeJ31GYu","","72","80"
"Delaney","Delaney_office","864235007514116096","2017-05-15 21:44:17","My statement - this is either pure incompetence or an attempt to place Russia above our allies and key partners https://t.co/tJ1ei3q3oU https://t.co/2dlJZlT8GN","","15","35"
"Delaney","Delaney_office","864143398479032324","2017-05-15 15:40:15","A bipartisan solution is only way we can actually get something done #infrastructureweek #TimetoBuild https://t.co/DCWUcyJnTE https://t.co/B8zU9GORiq","","0","4"
"Delaney","Delaney_office","864142542547406848","2017-05-15 15:36:51","I'm worried about the President pulling a bait and switch on infrastructure  https://t.co/DCWUcyJnTE #infrastructureweek https://t.co/qhSEOiOeqU","","3","6"
"Delaney","Delaney_office","864141695008616449","2017-05-15 15:33:29","Another Infrastructure Week, Another Year of Partisan Gridlock 
 https://t.co/DCWUcyJnTE #infrastructureweek","","1","2"
"Delaney","Delaney_office","864118339148410885","2017-05-15 14:00:41","Infrastructure investment will improve our quality of life. My bipartisan solution -&gt; https://t.co/emHRhqutOx #infrastructureweek https://t.co/d3bNNvytoc","","3","5"
"Delaney","Delaney_office","864109167237361664","2017-05-15 13:24:14","Looking forward to it! https://t.co/0V6T2DT51x","","0","4"
"Delaney","Delaney_office","864107739416604672","2017-05-15 13:18:34","It's #TimetoBuild. Proud to have authored bipartisan bills using int tax reform to rebuild #infrastructure https://t.co/emHRhqutOx","","1","3"
"Delaney","Delaney_office","864106699346636805","2017-05-15 13:14:26","Really enjoyed being at the Garrett Regional Medical Center in Oakland for the dedication of the Robert and June Harvey Medical Pavilion https://t.co/veHBSQpK6T","","0","0"
"Delaney","Delaney_office","863774464437354499","2017-05-14 15:14:15","Happy Mother's Day!","","1","11"
"Delaney","Delaney_office","863133286318714881","2017-05-12 20:46:26","In Oakland rallying to protect Garrett Co.'s HUBZone status. Proud to author bipartisan bill to protect local jobs https://t.co/zb5s0SEhJI https://t.co/FJtm8HyvFX","","10","16"
"Delaney","Delaney_office","863133126884720640","2017-05-12 20:45:48","RT @eblaisdell: Congressman John Delaney met with TDEC employees to discussion legislation to protect local jobs. Story to follow at https:…","","5","0"
"Delaney","Delaney_office","863113442584145920","2017-05-12 19:27:35","Trump’s actions and comments this week make it clear that he is either a) attempting a cover-up, b) is incredibly incompetent or c) both","","31","89"
"Delaney","Delaney_office","863107566670422016","2017-05-12 19:04:14","Over 175 people attended our College, Trade School and Financial Aid Workshop last night in Hagerstown https://t.co/zVwGLSeVmm https://t.co/VhtiXpGorN","","2","5"
"Delaney","Delaney_office","863055344943202304","2017-05-12 15:36:43","My legislation to #SaveOurHubzone in Garrett Co https://t.co/T6x7nPWC41","","0","0"
"Delaney","Delaney_office","863027811501707265","2017-05-12 13:47:19","@2mins4holding I'm a cosponsor of legislation to establish an independent investigation of Russian coordination w the Trump campaign to influence election","","0","1"
"Delaney","Delaney_office","863024367764217856","2017-05-12 13:33:38","More evidence that Trump either doesn’t understand our system of government or worse, doesn’t care  https://t.co/Ya4TIG65PM","","9","25"
"Delaney","Delaney_office","863024080001347584","2017-05-12 13:32:29","The Director of the FBI takes an oath to support and defend the Constitution, not an individual.  https://t.co/Ya4TIG65PM","","12","31"
"Delaney","Delaney_office","862994873963642884","2017-05-12 11:36:26","Congressman John Delaney held a College, Trade and Financial Aid workshop https://t.co/GinjrRgU8p","","0","4"
"Delaney","Delaney_office","862848927330119682","2017-05-12 01:56:29","Md. leaders take Reagan National airplane noise complaints to FAA | WTOP https://t.co/Kgxn2L2xOx via @WTOP","","0","0"
"Delaney","Delaney_office","862813914337357825","2017-05-11 23:37:22","Information on my meeting with local businesses and workers tomorrow in Garrett County https://t.co/0kEkij261i","","1","1"
"Delaney","Delaney_office","862689122795880448","2017-05-11 15:21:29","What a great College, Trade School and Financial Aid Workshop in Germantown last night! #MD6 https://t.co/M31ESsdAI9","","4","11"
"Delaney","Delaney_office","862678928523227137","2017-05-11 14:40:59","Over 300 Attend Delaney’s College, Trade School and Financial Aid Workshop in Germantown https://t.co/RxGynGjLSR https://t.co/zqUOdpyy8B","","0","6"
"Delaney","Delaney_office","862660117501804551","2017-05-11 13:26:14","Stay up to date on key votes, hearings and district events in #MD6 -&gt; signup for my e-newsletter https://t.co/EhJtbIzO3M","","3","3"
"Delaney","Delaney_office","862485756748673025","2017-05-11 01:53:23","Will be in Oakland friday to talk about my legislation to reform the SBA's HUBZone program + protect local jobs https://t.co/T6x7nPWC41","","2","3"
"Delaney","Delaney_office","862441205552078848","2017-05-10 22:56:21","RT @NorthwestJags: Thanks to @RepJohnDelaney for hosting his College, Trades &amp; Financial Aid Workshop at Northwest this evening!! https://t…","","5","0"
"Delaney","Delaney_office","862105049803128832","2017-05-10 00:40:35","Every Member of Congress who cares about our democracy should support an independent special prosecutor so we can get a full investigation https://t.co/D2rsukEZ4X","","50","87"
