"Harris","Harris_campaign","1005953760953339905","2018-06-10 23:24:00","Jeff Sessions should focus on issues like transnational criminal organizations and investigating and prosecuting human trafficking, not going after Americans who are using recreational and medicinal marijuana. https://t.co/ZbUR37cH09","","972","2928"
"Harris","Harris_campaign","1005933632211517440","2018-06-10 22:04:01","I’ve asked Secretary Carson to explain why this Administration believes raising rents for low-income households will do anything to help low-income families. I haven’t gotten a satisfactory answer. https://t.co/yixq24G5zU","","2944","6903"
"Harris","Harris_campaign","1005885154169098242","2018-06-10 18:51:23","A few days ago, I introduced legislation to end this Administration's cruel policy of breaking up families at the border because of the devastating consequences it can have. Our country needs to be better than this. https://t.co/1JtBmbkZin","","1094","3248"
"Harris","Harris_campaign","1005614021129703425","2018-06-10 00:54:00","I am so inspired by the hundreds of women of color leading our party in the 2018 elections. Their leadership will pave the way for the next generation. As my mother said, “you may be the first to do many things, but make sure you are not the last.” https://t.co/oUc2708i66","","1373","5429"
"Harris","Harris_campaign","1005582563652579329","2018-06-09 22:49:00","Quantum computing is the next technological frontier that will change the world and we cannot afford to fall behind. It could create jobs for the next generation, cure diseases, and above all else — make our nation stronger and safer. https://t.co/UfwZXK3baD","","244","700"
"Harris","Harris_campaign","1005567715883577344","2018-06-09 21:50:00","We must fight so our courts are not stacked with individuals who have spent their careers to undermining the equality of LGBTQ Americans. https://t.co/qkrENNEYSE","","892","2490"
"Harris","Harris_campaign","1005550356183568389","2018-06-09 20:41:01","In just a few days, #NetNeutrality will be ended by the FCC. The Senate has already voted to save the internet. Now it’s time for Paul Ryan to give the House a vote to protect our free and open internet. https://t.co/9bAoX6NPft","","1100","1519"
"Harris","Harris_campaign","1005533499581960193","2018-06-09 19:34:02","Legalizing marijuana at the federal level is about stopping our country from repeating the same mistakes of the past. Most Americans already know that too many lives have been needlessly ruined because of the War on Drugs. We need to get this done. https://t.co/fp44wzCHtg","","1479","4103"
"Harris","Harris_campaign","1005514112502321154","2018-06-09 18:17:00","This Administration’s deportation force is forcing immigrants back into the shadows. The consequences are devastating.  https://t.co/64N42uEkZB","","426","674"
"Harris","Harris_campaign","1005495741186498561","2018-06-09 17:04:00","Proud to stand in solidarity with those marching in Sacramento for the #BlackWomensMarch. They’re shining a light on the injustices and challenges faced by Black women every day in our country.","","1005","4049"
"Harris","Harris_campaign","1005489368734339072","2018-06-09 16:38:41","RT @tammybaldwin: Thrilled @KamalaHarris is joining me in Wisconsin today. Our first event talking to young folks in Madison and having som…","","108","0"
"Harris","Harris_campaign","1005485677922996224","2018-06-09 16:24:01","Today in Wisconsin, I'll be campaigning for my friend and colleague @tammybaldwin. Tammy has stood with us when we needed her most and has been an incredible advocate for women and the LGBTQ community. We need more women like her in Congress, not less. #Pride https://t.co/m7SneeFr1X","","214","970"
"Harris","Harris_campaign","1005484825661329408","2018-06-09 16:20:38","RT @tammybaldwin: “If she weren’t such a force speaking for working families... [special interests] wouldn’t be putting the millions of dol…","","194","0"
"Harris","Harris_campaign","1005468491921678337","2018-06-09 15:15:43","Congrats, @warriors! #DubNation, it's been an incredible season. #NBAChamps https://t.co/emVM1yiHfN","","96","695"
"Harris","Harris_campaign","1005253972339372034","2018-06-09 01:03:18","Our government continues to fail our fellow Americans in Puerto Rico. We need to dedicate the resources necessary for them to rebuild their lives, and we need to know why the government didn’t do it already. https://t.co/WTODh9T4u7","","2355","5122"
"Harris","Harris_campaign","1005234773298745344","2018-06-08 23:47:00","It’s time to end the culture of fear and silence that surrounds workplace harassment. We need to support victims and put companies on notice that they can’t keep secretly protecting harassers financially. https://t.co/Ufse7AV5C2","","620","1926"
"Harris","Harris_campaign","1005210109545537537","2018-06-08 22:09:00","We can’t let the Administration keep breaking up immigrant families like José’s. We need to stand with them and speak out. Call the White House and demand they put an end to this policy: 202-456-1111 https://t.co/n6eIjSkObn","","523","1129"
"Harris","Harris_campaign","1005194506726232065","2018-06-08 21:07:00","The Affordable Care Act ensures millions of Americans with pre-existing conditions have access to affordable care. This Administration wants to end that. https://t.co/c74ZsOuGKl","","1283","1863"
"Harris","Harris_campaign","1005178817160400897","2018-06-08 20:04:39","If you or a loved one needs it, help is available. Call 1-800-273-8255 for free and confidential support. https://t.co/UZMpF3vkLM","","236","484"
"Harris","Harris_campaign","1005164061615710208","2018-06-08 19:06:01","Gilbert Baker, the designer of the rainbow flag, created a symbol of pride for the LGBTQ movement. He refused to trademark it because he wanted it to belong to the entire LGBTQ community. #Pride https://t.co/INaWYk0gE7","","1037","5000"
"Harris","Harris_campaign","1005150268395327488","2018-06-08 18:11:13","The Administration wants to increase rent six times greater than the growth in average hourly earnings for low-income Americans. This is just cruel. We need to do more to help people find affordable housing, not force them into homelessness. https://t.co/po7B6BBWJL","","871","1402"
"Harris","Harris_campaign","1004917684109238272","2018-06-08 02:47:01","To tackle the challenges of the 21st century, we must empower women and girls. If we do not lift them up, everyone will fall short.","","1362","5444"
"Harris","Harris_campaign","1004903086454865920","2018-06-08 01:49:00","In just 5 days, the FCC will end #NetNeutrality at the federal level, eliminating vital protections for innovation and free speech. I’m proud that California leading the way to protect an open internet.
https://t.co/14BflyGNAo","","940","1821"
"Harris","Harris_campaign","1004887734920581121","2018-06-08 00:48:00","Mulvaney’s job is to protect and advocate for consumers. Instead, he's doing everything he can to weaken the safeguards protecting American families against predatory banks and corporations. https://t.co/VPXc7qnMYn","","923","1515"
"Harris","Harris_campaign","1004862321380950017","2018-06-07 23:07:01","We owe meaningful change in our laws not just to courageous women who have come forward in the #MeToo conversation, but also those who continue to be silenced. I'm introducing the bipartisan EMPOWER Act to strengthen our laws so workplace harassment will no longer go unpunished. https://t.co/G5t4lArmPA","","159","421"
"Harris","Harris_campaign","1004842184884019200","2018-06-07 21:47:00","We deserve more than silence from this White House about how and why the government failed our fellow Americans in Puerto Rico. A natural disaster should be treated with urgency no matter where it occurs. We deserve answers. https://t.co/orRE0oQX2L","","2136","5155"
"Harris","Harris_campaign","1004830057192452096","2018-06-07 20:58:49","In times like these, when our government works to reject LGBTQ rights, restrict women’s health care access, and break up immigrant families, we need to remind ourselves: No one should be left to fight alone. #Pride https://t.co/644jQR73MV","","424","1318"
"Harris","Harris_campaign","1004810479720640513","2018-06-07 19:41:01","My heart breaks for these kids being separated from their families at the border – many are just toddlers. We need to stand with immigrant families and speak out. Call the White House and demand they put an end to this inhumane policy: 202-456-1111 https://t.co/M5rv2gaJPz","","2299","4545"
"Harris","Harris_campaign","1004794121683456000","2018-06-07 18:36:01","Yesterday, I joined the NAACP and my congressional colleagues to speak out against the nomination of Thomas Farr for a lifetime position. He has spent decades trying to suppress voting rights and workers’ rights and is one of the worst of Trump's judicial nominees to date. https://t.co/oKU2rxthE1","","535","1244"
"Harris","Harris_campaign","1004770056927154176","2018-06-07 17:00:23","When @TammyBaldwin was elected in 2012, she made history — twice — as both the first openly LGBTQ person elected to the Senate in US history, and as WI's first woman elected to the Senate. We can't afford to lose a fighter like her. https://t.co/BbfCVcPDl6","","845","2206"
"Harris","Harris_campaign","1004753987487305734","2018-06-07 15:56:32","Let’s be clear about what this is — our government has mobilized a deportation force to break up families and deport immigrants who pose no harm to public safety. https://t.co/hpBM84vQOj","","3513","5878"
"Harris","Harris_campaign","1004548751623671808","2018-06-07 02:21:00","When disaster hits anywhere in America, our government has a basic responsibility to commit the resources necessary to save lives, accurately assess damage, and rebuild communities. We now know that after Hurricane Maria, our government failed Puerto Rico at every level.","","3529","10680"
"Harris","Harris_campaign","1004521572483371010","2018-06-07 00:33:00","Congratulations to @DeidreDeJear on being the first black nominee for statewide office in Iowa! Black women have voted at a higher rate than other groups, yet are continually underrepresented in elected office. In 2018, we have a chance to buck that trend. https://t.co/pXE4DAve6C","","886","3132"
"Harris","Harris_campaign","1004499328705036288","2018-06-06 23:04:37","The fact that Senator Merkley was denied entry to a federal immigration facility while trying to check the welfare of children is unacceptable. This Administration needs to give answers on how they're treating these kids, and they need to stop separating families at the border. https://t.co/3V1dv4ZbEw","","7943","16884"
"Harris","Harris_campaign","1004479109433618432","2018-06-06 21:44:16","How many more students and teachers in our schools are going to fall victim to senseless mass shootings before Betsy DeVos and this Administration will finally take the gun violence epidemic seriously? https://t.co/LI7uVhu1qO","","843","2209"
"Harris","Harris_campaign","1004461929396621313","2018-06-06 20:36:00","No one should be left to fight alone for their civil rights. We must commit to passing The Equality Act so that LGBTQ Americans in every community can live without the fear of being denied work, service, or a place to live simply because of who they are or who they love. #Pride https://t.co/AjiJ5VlfBl","","371","1099"
"Harris","Harris_campaign","1004447081891815426","2018-06-06 19:37:00","I will continue to oppose any nominee to our judiciary who has a track record of trying to suppress the rights of workers, communities of color, and immigrants. This includes Thomas Farr, who has been appointed for a lifetime position on the court. https://t.co/oPKc3HizrU","","1335","3815"
"Harris","Harris_campaign","1004422155579351040","2018-06-06 17:57:57","50 years ago this week, Bobby Kennedy was assassinated in Los Angeles, just shortly after winning the California primary. As we remember him, let's be inspired by his legacy of fighting for a better world for the next generation. https://t.co/C1sxc2xZHo","","423","1053"
"Harris","Harris_campaign","1004400957072072704","2018-06-06 16:33:43","Congratulations to @GavinNewsom and the hundreds of other Democrats leading our party into Election Day! They're going to need your support again this November — can they count on you? https://t.co/CvMlLlf99y","","979","3443"
"Harris","Harris_campaign","1004184607456194561","2018-06-06 02:14:01","Spread the word — if you're in line at your California polling place by 8PM, you still have the legal right to vote! Find out where to go here: https://t.co/r3Y6vNCMzc https://t.co/rFrufkvMxV","","1702","2880"
"Harris","Harris_campaign","1004167742407237632","2018-06-06 01:07:00","If we are going to live up to our ideals as a nation, it’s critical we focus on economic equality and economic justice. One key thing is making sure everyone has access to a good job, with fair wages, and safe working conditions.","","423","1617"
"Harris","Harris_campaign","1004153901397020673","2018-06-06 00:12:01","Dreamers represent the best of who we are as a nation. I won’t stop fighting to give them the security they need to live up to their full potential. https://t.co/ihhv0whVPr","","867","3868"
"Harris","Harris_campaign","1004129544431898624","2018-06-05 22:35:13","RT @KamalaHarris: California Democrats — it’s Election Day! The polls are now open until 8PM. It's critical you turn out and vote to make s…","","2472","0"
"Harris","Harris_campaign","1004125972944302081","2018-06-05 22:21:02","Voters in San Francisco are able to cast their ballot at City Hall today — my niece knows what's up!

Reminder: if your name is not on the voter list at your polling place, you can still cast a provisional ballot. Find out more here: https://t.co/yqJNRO0sZw https://t.co/YXDX2FMMPn","","305","1038"
"Harris","Harris_campaign","1004112652380012544","2018-06-05 21:28:06","RT @KamalaHarris: California Democrats — it’s Election Day! The polls are now open until 8PM. It's critical you turn out and vote to make s…","","574","0"
"Harris","Harris_campaign","1004106596409053184","2018-06-05 21:04:02","At a time when LGBTQ rights are under attack from the United State Congress to the United State Census, we need more leaders like Danica Roem to help change the equation. Public servants like her help make the conversation about who can lead, as opposed to who has led. #Pride https://t.co/rioIHXPL29","","315","1529"
"Harris","Harris_campaign","1004075890341568512","2018-06-05 19:02:01","We can’t afford to forget our government’s failures in Puerto Rico. Finding out why we were unable to accurately assess the damage or provide adequate resources to rebuild and save lives should be a top priority for Congress and this Administration. https://t.co/qqAeWUoodU","","511","1172"
"Harris","Harris_campaign","1004049232809091072","2018-06-05 17:16:06","I voted for @GavinNewsom because he'll pick up where Governor Brown left off and fight back against the Administration's attacks on our state and our values. Make sure you vote in today's primary! https://t.co/JcML1wWpXY","","915","4655"
"Harris","Harris_campaign","1004041920635658250","2018-06-05 16:47:02","These repeated attacks on Robert Mueller and the Russia investigation are beyond concerning — they’re dangerous. Congress must move forward on legislation that protects the special counsel before it’s too late.
https://t.co/F2xXDSTdZe","","1148","3285"
"Harris","Harris_campaign","1004024620289323012","2018-06-05 15:38:18","The culture of fear and silence created by perpetrators of sexual harassment in American workplaces must end. The EMPOWER Act will strengthen our laws so this misconduct will no longer remain unpunished and in the shadows. https://t.co/wnsOhjM27u","","333","1037"
"Harris","Harris_campaign","1004016258914930688","2018-06-05 15:05:04","California Democrats — it’s Election Day! The polls are now open until 8PM. It's critical you turn out and vote to make sure Democrats are on the ballot in November. Find out where you’re voting here: https://t.co/r3Y6vNCMzc https://t.co/vnai1jDxUc","","574","1226"
"Harris","Harris_campaign","1004010001910910976","2018-06-05 14:40:12","California Democrats — it’s Election Day! The polls are now open until 8PM. It's critical you turn out and vote to make sure Democrats are on the ballot in November. Find out where you’re voting here: https://t.co/r3Y6vNCMzc https://t.co/qUhHaFUdMF","","2472","4760"
"Harris","Harris_campaign","1003837570793517058","2018-06-05 03:15:01","4/10 mothers are their family’s primary wage earner. Equal pay isn’t just about fairness in the workforce, it’s about justice for families.","","1193","4728"
"Harris","Harris_campaign","1003799824783892480","2018-06-05 00:45:02","This Administration's efforts to expand offshore drilling in our state pose a grave threat to the health and well-being of Californians. I'm grateful to see our state's leaders taking action to stand up for our natural resources and public health. https://t.co/PufsStDCSW","","386","1022"
"Harris","Harris_campaign","1003785224319270912","2018-06-04 23:47:01","As San Francisco’s District Attorney and California’s Attorney General, I helped make CA the first state to outlaw “gay/trans panic” defense, which is used to justify horrible acts of violence against LGBTQ people. This #Pride Month, let’s commit to banning it nationwide. https://t.co/LFFdLE6zdZ","","495","1618"
"Harris","Harris_campaign","1003781596694994944","2018-06-04 23:32:36","Every time we enter the voting booth, we’re voting for the kind of future we want for the next generation. Californians, be a role model for our kids and make a plan to vote in tomorrow’s primary. Find out where to vote here: https://t.co/r3Y6vNlbaC https://t.co/SgUSOBDdA5","","520","1623"
"Harris","Harris_campaign","1003775657153826819","2018-06-04 23:09:00","This deserves far more attention from our government and media than it’s getting. Our government’s catastrophic failures in the aftermath of Hurricane Maria cost lives — and we’ve even failed to assess the damage. Finding out why should be a top priority. https://t.co/LOwfi5zJpW","","2543","6253"
"Harris","Harris_campaign","1003752002852139009","2018-06-04 21:35:00","Discrimination should have no place in our schools. Under Betsy DeVos, our government is losing sight of that basic truth in our public education system. https://t.co/VmId3wq3SE","","1121","2881"
"Harris","Harris_campaign","1003735896783511556","2018-06-04 20:31:00","It is outrageous that a United States Senator would be barred from entering a federal facility while trying to check on the welfare of children separated from their parents at the border. What does our government have to hide? https://t.co/v8ewae8Jzy","","15938","34067"
"Harris","Harris_campaign","1003723995743735809","2018-06-04 19:43:43","California Democrats, are you ready to vote in tomorrow's primary? It's critical you turn out and vote to make sure Democrats are on the ballot in November. Find out where you’ll be voting here: https://t.co/r3Y6vNCMzc https://t.co/gmoKkPO1N4","","526","935"
"Harris","Harris_campaign","1003703528370724870","2018-06-04 18:22:23","Instead of sabotaging the ACA and protecting drug company profits, our government should be working to make health care better and more affordable for every American. We need to negotiate prescription drugs costs and we need #MedicareforAll. https://t.co/RtuCkh7Ftr","","393","983"
"Harris","Harris_campaign","1003672680502038528","2018-06-04 16:19:49","No business should be allowed to discriminate against any American based on who they are or who they love. Our constitution requires equal protection under the law. Full stop. https://t.co/fkGGs1pYXs","","1309","4404"
"Harris","Harris_campaign","1003444980025843714","2018-06-04 01:15:01","As they brace for another hurricane season, we still don’t know why our government failed Puerto Rico so drastically after Hurricane Maria. We need to invest top-level resources to investigate why it happened and how we can stop it from happening again. https://t.co/mt3ULniWm6","","1377","3326"
"Harris","Harris_campaign","1003422832154603520","2018-06-03 23:47:00","The gap between the rich and the poor continues to grow. Tackling income inequality is one of the most pressing issues of our time. It must be addressed through living wages, equal pay for equal work, and access to quality, affordable education.","","2891","9300"
"Harris","Harris_campaign","1003402704788566018","2018-06-03 22:27:01","California Democrats, are you ready to vote in Tuesday’s primary? It's critical you turn out and vote to make sure Democrats are on the ballot in November. Find out where you’ll be voting on Tuesday here: https://t.co/r3Y6vNCMzc https://t.co/X02B39Lxh5","","1639","2928"
"Harris","Harris_campaign","1003379547507699714","2018-06-03 20:55:00","I’m happy to see the courts step in to block this unconstitutional abortion law in Iowa. Republicans in Washington and across the country are doing everything they can to restrict access to safe and legal abortion. It’s up to all of us to stop them. https://t.co/pTu2QTrydn","","556","1917"
"Harris","Harris_campaign","1003358408853147648","2018-06-03 19:31:00","We’ve lost far too many of our classmates, friends, family members and children to gun violence. Another moment of silence is not enough.","","793","3302"
"Harris","Harris_campaign","1003338505207115777","2018-06-03 18:11:55","Violence against trans women of color is at record highs, and politicians are trying to exclude transgender Americans from public services, civil rights protections, and military service. Today, the leadership of trans women like Andrea Jenkins is vital for our democracy. #Pride https://t.co/i6rvYamvO1","","432","1288"
"Harris","Harris_campaign","1003078060751638529","2018-06-03 00:57:00","Instead of gutting regulations on the Wall Street banks who ruined so many lives, we should be fighting even harder to ensure our economy is fair for working Americans.","","1690","6404"
"Harris","Harris_campaign","1003049119798255616","2018-06-02 23:02:00","This Administration’s disregard for immigrant children is shocking. We can keep America safe without removing fundamental humanitarian protections for children and their families.  https://t.co/s6w9M7WTms","","702","1834"
"Harris","Harris_campaign","1003034534009622529","2018-06-02 22:04:03","It is a true honor to be among my fellow AKAs and Links in Akron. All of you are doing such great work for Black women and dedicating yourselves to service and to each other. https://t.co/ILxK8j8jV2","","147","713"
"Harris","Harris_campaign","1003024320036245506","2018-06-02 21:23:27","I do not believe we are divided. I believe that the vast majority of us have so much more in common than what separates us, and I know that to be true.

Read more from this week’s San Fernando Valley town hall here: https://t.co/psPMKcTvzs https://t.co/QjATzwF8c8","","160","808"
"Harris","Harris_campaign","1003011126592974848","2018-06-02 20:31:02","We’ve lost too many children, classmates, friends, and family members to gun violence. Enough is enough — we must demand Congress finally take action to pass common sense gun laws.","","1120","4199"
"Harris","Harris_campaign","1002993505390813198","2018-06-02 19:21:01","Because of our government’s failed response to Hurricane Maria in Puerto Rico, thousands of families have been faced with greater confusion and tragedy. We need to invest top-level resources into investigating these failures. https://t.co/zusjNT1PSC","","633","1601"
"Harris","Harris_campaign","1002976668967895041","2018-06-02 18:14:06","114 million Americans have no paid family leave, which means too many families are having to choose between caring for their loved ones or putting food on the table. We need to guarantee paid family leave across our country. https://t.co/Js61hUro18","","311","868"
"Harris","Harris_campaign","1002947804967383040","2018-06-02 16:19:25","Like the generations of #Pride they inspired, the riots at the Stonewall Inn in 1969 served to show LGBTQ people across America: no one should be left to fight alone. Despite the forces of hate trying to tear us apart, we have so much more in common than what separates us. https://t.co/SzquxkLjdm","","249","849"
"Harris","Harris_campaign","1002715171058606080","2018-06-02 00:55:00","It is long past due for Congress to have the courage to pass reasonable gun safety laws. This is not a question of right or left. It's a question of right or wrong.","","2842","11485"
"Harris","Harris_campaign","1002686485336854531","2018-06-01 23:01:01","We can’t afford to let the Administration get comfortable with breaking up families. We need to stand with immigrant families and speak out. Call the White House and demand they put an end to this inhumane policy: 202-456-1111 https://t.co/p0NIEPPuhg","","1313","2602"
"Harris","Harris_campaign","1002672143937785861","2018-06-01 22:04:02","This exhibit from the Kamoinge photographers collective is both inspiring and empowering. Representation matters in leadership, in the workplace, and in the arts. https://t.co/m43w6bimup","","218","816"
"Harris","Harris_campaign","1002645968611938305","2018-06-01 20:20:01","This deserves to be investigated with top-level resources. We need to know why our government failed the people of Puerto Rico when they needed us most. And we need to know how to make sure it never happens again.
https://t.co/r1jnPkizjQ","","2142","4734"
