"Harris","Harris_campaign","968884648314114048","2018-02-28 16:24:35","I am sick and tired of Republican politicians playing politics with our health care and going out of their way to target women’s constitutional right to choose. We deserve better. https://t.co/1rBIF3J92l","","7005","21037"
"Harris","Harris_campaign","968676126594928640","2018-02-28 02:36:00","It is long past due for Congress to have the courage to pass reasonable gun safety laws. This is not a question of right or left. It's a question of right or wrong.","","2873","11635"
"Harris","Harris_campaign","968654737217392645","2018-02-28 01:11:00","The basic principle of Net Neutrality is that access to all websites should be treated equally. What the FCC is doing right now is empowering broadband service providers to distort the online marketplace and set up a pay-for-play system. We must reverse this decision.","","3206","7966"
"Harris","Harris_campaign","968624792365600769","2018-02-27 23:12:01","“For too long, people have spoken for us and perpetuated false representations of the issues that drive our votes.” Congratulations @AliciaGarza on the launch of @blackfutureslab! https://t.co/CslwJTRGgT","","167","586"
"Harris","Harris_campaign","968594843860656128","2018-02-27 21:13:01","This decision is an incredible victory for LGBT workers across the country. Now we must build on this progress and ensure our country stands on the side of equality. https://t.co/dD8tsRoCab","","459","1753"
"Harris","Harris_campaign","968567997194493954","2018-02-27 19:26:20","American workers deserve better than corporate attacks on labor unions. That's why we need to strengthen worker protections and empower workers to negotiate better wages and benefits. https://t.co/nHBZWyctJB","","355","937"
"Harris","Harris_campaign","968530311511502849","2018-02-27 16:56:35","Let's be honest: this Administration doesn't want a solution for Dreamers. They want red meat for their base. They want to purge America's history as a nation of immigrants.","","4777","16192"
"Harris","Harris_campaign","968313235416825856","2018-02-27 02:34:00","Common decency in our society demands respect for women's safety and equality in the workplace.","","1002","4746"
"Harris","Harris_campaign","968295368344694785","2018-02-27 01:23:00","Access to health care should never be a function of somebody’s wealth, which is why I am proud to have co-sponsored the Medicare for All Act.","","2580","11076"
"Harris","Harris_campaign","968267937311150081","2018-02-26 23:34:00","Time is running out to protect Dreamers. Right now, hundreds of thousands of Dreamers are terrified. Let’s give them peace of mind so they can continue to contribute to our colleges and universities, our military, and our businesses.","","1054","3406"
"Harris","Harris_campaign","968231950279352320","2018-02-26 21:11:00","“With unerring honesty and lively wit, she describes her triumphs and her disappointments, both public and private, telling her full story as she has lived it—in her own words and on her own terms.” Very excited to read @MichelleObama's new book! https://t.co/Tmb6ANa3de https://t.co/IPrpfqsB95","","206","923"
"Harris","Harris_campaign","968202505849942016","2018-02-26 19:14:00","Even though these times require us to resist, we are not fighting against something. Here's what we're fighting for: 

✅ $15 minimum wage
✅ Health care as a right for all
✅ Reasonable gun safety laws 
✅ Tuition-free college 
✅ Middle-class tax cuts 
✅ Immigration reform","","7610","22671"
"Harris","Harris_campaign","968148501883432960","2018-02-26 15:39:24","People don’t think about their lives in some demographic category a pollster put them in. https://t.co/lE7bJmg4TS","","483","1856"
"Harris","Harris_campaign","967947072707158016","2018-02-26 02:19:00","Dreamers should not be pitted against their families or traded away like some commodity in exchange for a un-American, $25 billion wall.","","1954","6792"
"Harris","Harris_campaign","967935496272846848","2018-02-26 01:33:00","90 Americans are killed, on average, every day by guns. We must honestly acknowledge the epidemic of gun violence and work together to curb it.","","2961","9707"
"Harris","Harris_campaign","967912595993882629","2018-02-26 00:02:00","""I can only hope that when a young woman sees this film she can just feel like it's possible, like anything's possible."" https://t.co/Ww6cFjiFoL #WakandaForever","","722","3313"
"Harris","Harris_campaign","967887933494538240","2018-02-25 22:24:00","Here's the truth: the Republican tax plan is nothing more than a $1 trillion bank heist that will be paid by our children and our seniors for years to come.","","5091","14367"
"Harris","Harris_campaign","967863019056197632","2018-02-25 20:45:00","Nobody should have to work a job flipping burgers at 75 years old. Every American should be able to retire with dignity.","","4859","23244"
"Harris","Harris_campaign","967827206683725824","2018-02-25 18:22:42","2018 is the most important year of our lives. To quote @DoloresHuerta: “Every moment is an organizing opportunity, every person a potential activist, every minute a chance to change the world.” https://t.co/XXIknjUsMm","","1151","3395"
"Harris","Harris_campaign","967560063455031298","2018-02-25 00:41:10","The challenge for us in 2018 is to remind Americans how much more we have in common than what separates us, regardless of what this president tweets on a given day. #cadem2018 https://t.co/hr1n746jig","","354","1315"
"Harris","Harris_campaign","967557598215049217","2018-02-25 00:31:22","RT @CA_Dem: Wise words from U.S. Senator @KamalaHarris. #CADem2018 https://t.co/NZTnJLzsRJ","","237","0"
"Harris","Harris_campaign","967553227519504384","2018-02-25 00:14:00","Arming teachers is a an incredibly bad idea. Instead of making teachers do yet another job, we should help them buy school supplies and educate our children.","","4723","20909"
"Harris","Harris_campaign","967510697562210304","2018-02-24 21:25:00","Today we’re compiling feedback from supporters like you for our February issues survey, and I’m reaching out to ask if you can spare a short moment to add your thoughts here:
https://t.co/efwwgr4i2g","","91","277"
"Harris","Harris_campaign","967493081846120448","2018-02-24 20:15:00","Congratulations to the U.S. men's curling team on winning their first ever gold medal! @usacurl https://t.co/45ZdQUNGSM","","217","1765"
"Harris","Harris_campaign","967445802040922113","2018-02-24 17:07:08","The cycle of gun violence in America has to end. But as @GabbyGiffords has said: ""It will only happen when politicians realize they have more to fear from you than they do the gun lobby. And that starts with making your voice heard.""","","4594","13579"
"Harris","Harris_campaign","967226324057186305","2018-02-24 02:35:00","We cannot despair — progress does not happen overnight. It’s time to roll up our sleeves and continue to fight for our values.","","2169","10141"
"Harris","Harris_campaign","967192853561700352","2018-02-24 00:22:00","Mari Copeny is an incredible young woman and activist. She is another example of our kids leading. The future is bright. @LittleMissFlint https://t.co/I3fcIJfAxI","","745","2697"
"Harris","Harris_campaign","967160641306943489","2018-02-23 22:14:00","It's shameful the NRA is rejecting bipartisan calls to pass reasonable gun safety laws. Instead, they are attacking anyone with the courage to stand up to them. We can't give in or be silent. Let’s keep fighting until our kids and our communities are safe from gun violence.","","7189","26509"
"Harris","Harris_campaign","967122892990373888","2018-02-23 19:44:00","Every single day we fail to protect DACA recipients is a day our country is failing an important moral test. We are running out of time.","","2311","7346"
"Harris","Harris_campaign","967080189883797504","2018-02-23 16:54:19","Let’s work now to ban weapons of war whose primary purpose is to kill the largest number of human beings in the shortest amount of time possible. Let’s get this done and keep our schools safe.","","327","1621"
"Harris","Harris_campaign","967080104382881792","2018-02-23 16:53:59","Now is the time for Congress to follow their lead. Let’s acknowledge the epidemic of gun violence -- and the corrupting influence of the gun lobby in Washington. Let’s bust the false choice that you can either support the Second Amendment or support reasonable gun safety laws.","","239","1263"
"Harris","Harris_campaign","967079834479407105","2018-02-23 16:52:54","Gun violence has become routine in America. We have lost too many of our classmates, friends, family members, and children to this epidemic. As a nation, we are weary — but the courage of the students, faculty, and parents at Stoneman Douglas is creating new energy in this fight. https://t.co/ufnC8Nwcq5","","618","3078"
"Harris","Harris_campaign","966861922288074752","2018-02-23 02:27:00","A majority of Americans support common sense gun safety reforms -- yet politicians continue to cower in fear of the gun lobby. Congress needs more leadership like what we’re seeing from the students at Stoneman Douglas High School.","","4926","19269"
"Harris","Harris_campaign","966834492412329984","2018-02-23 00:38:00","Congratulations to the US Women’s Hockey Team on a stunning victory in the Olympics! https://t.co/CbH3DTWjS8","","295","2220"
"Harris","Harris_campaign","966790954941370368","2018-02-22 21:45:00","If you are frustrated by inaction on gun violence in Washington or your local government, here’s my advice: run for something. We need your voice and your leadership to reset the priorities and make progress. https://t.co/QYMen3QQS7","","1185","3778"
"Harris","Harris_campaign","966761763248230402","2018-02-22 19:49:00","58 percent of Asian American women and 63 percent of Native Hawaiian and Pacific Islander women are mothers with children under the age of 19. They need #AAPIEqualPay now.","","252","896"
"Harris","Harris_campaign","966756226666151936","2018-02-22 19:27:00","The #WageGap and a lack of #paidleave drive racial and gender disparities that rob many from contributing their talent and innovation to the workforce.  #AAPIEqualPay","","155","539"
"Harris","Harris_campaign","966750438572810241","2018-02-22 19:04:00","Today marks Asian American Women’s Equal Pay Day, the symbolic date when Asian American women’s earnings on average “catch up” to non-Hispanic white men’s earnings from the previous year. #AAPIEqualPay","","553","1602"
"Harris","Harris_campaign","966739113335377925","2018-02-22 18:19:00","Fighting to end the gun violence epidemic is about more than politics — it’s just the right thing to do. I haven’t forgotten the lives lost at Sandy Hook or in San Bernardino or last week at Stoneman Douglas High School. Let’s get this done and keep our communities safe.","","1053","3999"
"Harris","Harris_campaign","966704989975478274","2018-02-22 16:03:24","I am not going to be silenced by attacks from the NRA or anyone else — and neither will my Senate colleagues or the students from Stoneman Douglas. It's time to stand up to the gun lobby and keep our communities safe. #NeverAgain","","7478","28952"
"Harris","Harris_campaign","966496263330963456","2018-02-22 02:14:00","Congress needs to stop playing politics with people's lives and do right by Dreamers. We're running out of time. https://t.co/vSLWsPthl5","","698","2391"
"Harris","Harris_campaign","966458766332870656","2018-02-21 23:45:00","The future is female ♀ https://t.co/rhvd8VES3N","","1130","5078"
"Harris","Harris_campaign","966420010943033344","2018-02-21 21:11:00","These kids are incredible and courageous. They are speaking truth to power and changing the debate about gun violence. It’s time for Congress to follow their lead. https://t.co/jbXJMYcXeZ","","2408","10128"
"Harris","Harris_campaign","966393401926148096","2018-02-21 19:25:16","Dreamers contribute to our society and our economy in all sorts of ways — including on a movie as successful and impactful as Black Panther. https://t.co/FXEI24xyT7","","667","2777"
"Harris","Harris_campaign","966164074349432832","2018-02-21 04:14:00","The gun lobby will continue to wield tremendous influence in Washington until we elect a Congress that says ENOUGH is ENOUGH to gun violence.","","3822","14152"
"Harris","Harris_campaign","966141425384476672","2018-02-21 02:44:00","Black Panther’s celebration of strong Black women is inspiring and empowering. Shuri, Okoye, Nakia, and Ramonda are deep, powerful characters who remind us that representation in media can have a profound effect in our society. #WakandaForever https://t.co/unJfjnhwFv","","2003","8652"
"Harris","Harris_campaign","966118775564087296","2018-02-21 01:14:00","Our country is stronger when everyone has access to affordable health care at every stage of their life, from birth on up. #MedicareforAll","","1077","4684"
"Harris","Harris_campaign","966082034094374914","2018-02-20 22:48:00","Sign @GabbyGiffords pledge: ""I promise that I will Vote Courage in November and support candidates who will stand up to the gun lobby and take action to make our communities safer from gun violence."" https://t.co/hYCAJmgUfX","","1118","3008"
"Harris","Harris_campaign","966042523339804673","2018-02-20 20:11:00","Let's steel ourselves for the fight ahead. But let's remember in our fight, we have never been one to throw up our hands when it is time to roll up our sleeves. Let us rededicate ourselves to each other and to our country. Let's continue getting to work and fighting.","","988","4449"
"Harris","Harris_campaign","966003849872977920","2018-02-20 17:37:19","Breaking up families and separating kids from their parents is wrong. We can keep America safe without being callous. We must do better. https://t.co/yl3chHG1Gj","","462","1557"
"Harris","Harris_campaign","965995339567247360","2018-02-20 17:03:30","RT @KamalaHarris: Let’s be clear: Dreamers study in our colleges, serve in our military, and work in Fortune 100 companies. And they are co…","","4381","0"
"Harris","Harris_campaign","965790110129143808","2018-02-20 03:28:00","We have failed a generation of Americans when it comes to the gun violence epidemic, and we are poised to fail another if Congress doesn’t act now. https://t.co/rF8UBao31v","","2456","7347"
"Harris","Harris_campaign","965757142736060416","2018-02-20 01:17:00","As a nation of immigrants, we can’t turn our backs on Dreamers, potentially forcing them to leave the only home they’ve ever known.","","1763","7943"
"Harris","Harris_campaign","965730467566665728","2018-02-19 23:31:00","“I recorded those videos because I didn’t know if I was going to survive. But I knew that if those videos survived, they would echo on and tell the story. And that story would be one that would change things, I hoped. And that would be my legacy.” https://t.co/qEiKJFqZvU","","1847","5455"
"Harris","Harris_campaign","965711089399934977","2018-02-19 22:14:00","“We can't ignore the issues of gun control that this tragedy raises. And so, I'm asking -- no, demanding -- we take action now.”

Mark your calendar for March 24th: https://t.co/pSWuvJEs2v","","1753","5374"
"Harris","Harris_campaign","965688440116232192","2018-02-19 20:44:00","""I’m surrounded by women who are doing amazing things, who strive w/ great purpose toward their goals, have agency &amp; powerful work ethics. They never wait around to be saved by anyone else. I'm really excited to see those depictions coming to the screen.” https://t.co/9UsM28Ocnu","","770","3499"
"Harris","Harris_campaign","965655724838633472","2018-02-19 18:34:00","It's time for Congress to have the same courage and compassion as Emma Gonzalez and the parents, students, and faculty at Marjory Stoneman Douglas High School. It’s time to stand up to the gun lobby. #WeCallBS https://t.co/7JkbmVeRHT","","1348","4740"
"Harris","Harris_campaign","965625022688641024","2018-02-19 16:32:00","A terrific and empowering initiative. #WakandaForever https://t.co/ryjpyRnWWh","","988","5087"
"Harris","Harris_campaign","965415873044451328","2018-02-19 02:40:55","#WakandaForever https://t.co/J1MInlVRnB","","1411","12323"
"Harris","Harris_campaign","965408847526428672","2018-02-19 02:13:00","Let’s be clear: Dreamers study in our colleges, serve in our military, and work in Fortune 100 companies. And they are contributing to our economy in ways that benefit all of us.","","4381","18929"
"Harris","Harris_campaign","965363801829736449","2018-02-18 23:14:00","Another legal victory makes clear that President Trump’s Muslim ban is unconstitutional and discriminatory. It runs counter to our values as Americans and as a nation of immigrants. https://t.co/4YSP6zVN0Q","","1112","4148"
"Harris","Harris_campaign","965326053085507584","2018-02-18 20:44:00","Congratulations to fellow Howard alum @chadwickboseman and all those who worked on and contributed to @theblackpanther. An incredible story and set design that brings #Wakanda to life and demonstrates black excellence at its finest. ✊🏿","","590","3616"
"Harris","Harris_campaign","965268844519542785","2018-02-18 16:56:41","Feeling those #sundayvibes. Thanks, @common! https://t.co/ZzWmoakC6l","","495","3590"
"Harris","Harris_campaign","965062315199442944","2018-02-18 03:16:00","“Consider this: a film that explores what it means to be black, centered on a black superhero, featuring a mostly-black cast, and helmed by a black director is on pace to be one of Marvel's biggest blockbusters.”
https://t.co/WQS0j2IfUc","","4017","20018"
"Harris","Harris_campaign","965024566828412928","2018-02-18 00:46:00","We desperately need leaders in Washington who will stand up to the gun lobby. This crisis is destroying communities.","","4575","20843"
"Harris","Harris_campaign","964991095686877184","2018-02-17 22:33:00","From business to the arts, to science, sports and everything in between, the achievements and contributions made by African-Americans should not only be celebrated this month but every month because Black history is American history. #BlackHistoryMonth","","644","2481"
"Harris","Harris_campaign","964956114596061184","2018-02-17 20:14:00","Back in June, I released a playlist celebrating the vast contributions of Black artists in jazz, R&amp;B, rap, hip-hop, and beyond. Check it out here: https://t.co/fM5uZ57yqv  #BlackHistoryMonth","","161","607"
"Harris","Harris_campaign","964906937358876673","2018-02-17 16:58:35","Trump's budget will only worsen the student loan debt crisis, not address it. We have to work to ensure everyone in America can go to college without being weighed down by mountains of debt. https://t.co/799LzDZalt","","918","2324"
"Harris","Harris_campaign","964707224475045888","2018-02-17 03:45:00","Our supposed leaders in Washington need to stop attacking immigrants and instead make clear that America is a place where immigrants and refugees are welcome and contribute to our society.","","1191","4991"
"Harris","Harris_campaign","964672496430665728","2018-02-17 01:27:00","We won’t be silenced. https://t.co/oQpd8J0L35","","581","3372"
"Harris","Harris_campaign","964649595589492737","2018-02-16 23:56:00","RT @GavinNewsom: I've known @KamalaHarris for over two decades. From our work in San Francisco together, to her work in Washington, DC, she…","","680","0"
"Harris","Harris_campaign","964645064860368896","2018-02-16 23:38:00","We’ve lost too many children, classmates, friends, and family members to gun violence. It’s had a devastating impact on our communities. When do we say enough is enough and actually pass common-sense gun safety laws?","","2286","9325"
"Harris","Harris_campaign","964606562399535104","2018-02-16 21:05:00","“I always wanted to tell a story where a queer black woman was the protagonist, and I’m so grateful to @TBSNetwork for giving me a platform to tell this story.” Congratulations @LenaWaithe! I can’t wait to watch. https://t.co/8UMHoMWqgB","","234","1600"
"Harris","Harris_campaign","964573846606090241","2018-02-16 18:55:00","Trump’s budget: 

✂ Cuts Medicaid by $1.1 trillion
✂ Cuts Social Security by $72 billion
✂ Cuts Medicare by $266 billion

No one can argue with a straight face that our nation is made stronger by cutting these priorities. Families and seniors will suffer. This is immoral.","","8164","16209"
"Harris","Harris_campaign","964544327669166081","2018-02-16 16:57:42","We cannot tolerate a society and live in a country with pride when our babies are being slaughtered. https://t.co/06JwL4ppvS","","3803","11763"
"Harris","Harris_campaign","964314638199308288","2018-02-16 01:45:00","“This happens nowhere other than the United States of America, this epidemic of mass slaughter, the scourge of school shooting after school shooting. We’re responsible for a level of mass atrocity that happens in this country w/ zero parallel.” Couldn’t agree more, @ChrisMurphyCT","","3165","9582"
"Harris","Harris_campaign","964261538247970816","2018-02-15 22:14:00","Shirley Chisholm created a path for me and so many others. She is one of the reasons I am serving the people of California in the U.S. Senate today. #BlackHistoryMonth https://t.co/wamP98Fj1X","","1160","4925"
"Harris","Harris_campaign","964220013941960704","2018-02-15 19:29:00","No American should have to experience or live in fear of gun violence, especially children in their classrooms. We must ensure our kids are safe at school and that dangerous weapons stay out of the wrong hands. https://t.co/OfpmcRt6hr","","531","1850"
"Harris","Harris_campaign","964189312395988992","2018-02-15 17:27:00","We made a promise to Dreamers that if they came forward and got vetted, they would be safe. It's time for Congress to honor that promise.","","894","3743"
"Harris","Harris_campaign","964164036467347456","2018-02-15 15:46:34","Football Coach Aaron Feis, 37-years-old, was a victim of gun violence yesterday when he jumped in front of his students to protect them from the shooter. 

Rest In Peace. https://t.co/gVl6nqJ6mU","","4213","16063"
"Harris","Harris_campaign","963930104404602880","2018-02-15 00:17:00","Our leaders need to lead. Stand up to the gun lobby and do what's right ​to keep our children safe from gun violence.","","5609","21067"
"Harris","Harris_campaign","963898839253037056","2018-02-14 22:12:46","Just awful, gut-wrenching news. My heart breaks for the victims and families of the horrific shooting in Parkland, FL. This is the 18th school shooting in the first 43 days of 2018. ​We cannot accept this as normal. We must address gun violence. https://t.co/QYrhLkKgi6","","5118","13495"
"Harris","Harris_campaign","963857123091275776","2018-02-14 19:27:00","""It matters to a child—and to an adult—to, yes, see some reflection of themselves. But also to have the faraway heroes, the almost impossible ideals. Maybe those unreachable gods somehow help clarify things here on Earth.” https://t.co/VUn57SE25e","","543","3078"
"Harris","Harris_campaign","963822427909382146","2018-02-14 17:09:08","Happy Valentine’s Day to my wonderful husband Doug! Love you. https://t.co/TwcmX0Aohc","","409","6405"
"Harris","Harris_campaign","963599173760233472","2018-02-14 02:22:00","My message to the Dreamers: I am so proud of you. Keep your chin up and your shoulders back, and stay strong. What you are doing is what inspires me to know that there are better days ahead.","","2149","9452"
"Harris","Harris_campaign","963571491022422016","2018-02-14 00:32:00","“Abuse comes in many forms. It is visited on the poor and the rich, the least educated and the most, people with a strong and deep network of friends and family and those without a support structure.” https://t.co/DJQxYAv6md","","589","1668"
"Harris","Harris_campaign","963544311890669568","2018-02-13 22:44:00","Equating Dreamers with criminals — as the Trump Administration has done time and time again — is just plain wrong. Scaring the American people into supporting your anti-immigrant agenda is abhorrent.","","1608","4859"
"Harris","Harris_campaign","963521159584088064","2018-02-13 21:12:00","“It isn’t just the idea that black people will exist in the future, will use technology and science, will travel deep into space. It is the idea that we will have won the future. There exists, somewhere within us, an image in which we are whole, in which we are home.” https://t.co/Z9Deqa34Bl","","1834","7232"
"Harris","Harris_campaign","963491968050388992","2018-02-13 19:16:00","We must invest in infrastructure to be able to create good paying jobs, connecting housing to opportunity, and ensure America can compete in the global economy. Instead, the WH plan leaves states and localities with the bill.","","1053","2904"
"Harris","Harris_campaign","963443941180952577","2018-02-13 16:05:10","For the second year in a row, fewer undocumented youth applied for financial aid in California because they are distrustful of our government. This is a direct product of Trump's anti-immigrant agenda. No one in America should ever have to live in fear of our government. https://t.co/SBHqXfBcmR","","628","1573"
"Harris","Harris_campaign","963239806321897472","2018-02-13 02:34:00","Whenever someone tells you your dreams aren't achievable, whenever you feel alone, whenever you find yourself in a room where there aren't a lot of people who look like you, remember that you have an entire community in that room with you, all of us cheering you on. https://t.co/xW3GYXe8JH","","837","3576"
"Harris","Harris_campaign","963192242776059904","2018-02-12 23:25:00","The federal minimum wage is too low to support a family. That’s why I’ve supported raising the federal minimum wage to $15 an hour.","","4173","18832"
