"Harris","Harris_campaign","1083905401471549440","2019-01-12 01:56:00","Too many people are being harmed by the president’s need for a vanity project. This time, it’s survivors of domestic violence and child abuse.
https://t.co/CjRqgbbMiQ","","948","2965"
"Harris","Harris_campaign","1083880251657240576","2019-01-12 00:16:04","A few days ago I asked people to share how the government shutdown was affecting them. Thousands wrote in — sharing stories about their wife who is furloughed or their closest friend that has to borrow money to make rent this month. This is Laura’s story. #ShutdownStories https://t.co/EFHGfvfAca","","817","1833"
"Harris","Harris_campaign","1083858847775764480","2019-01-11 22:51:01","One month ago at a meeting with Democratic leaders, the president said, “I am proud to shut down the government for border security...so I will take the mantle. I will be the one to shut it down.”

He did it and now 800,000 federal workers are suffering. Reopen the government.","","4753","16441"
"Harris","Harris_campaign","1083847528842436608","2019-01-11 22:06:02","The House passed two bills last week to reopen the government, and yesterday, McConnell blocked them. 

Let that sink in. Tomorrow we break the record for the longest government shutdown. Let’s vote on these bills.","","11316","33313"
"Harris","Harris_campaign","1083831425462345728","2019-01-11 21:02:03","This is the real cost of the shutdown. A breast cancer survivor having to decide between buying medications or buying food. A family selling their truck to pay for the house and keep the heat on. This shutdown is hurting Americans. 
https://t.co/ziuj3WvJk5","","2376","4307"
"Harris","Harris_campaign","1083818334871867394","2019-01-11 20:10:02","Many asylum seekers, like Nilda and her two-year-old son, come to the United States seeking safety from domestic abuse and gang violence. A look at her life:
https://t.co/B4QqfTlHlb","","531","1537"
"Harris","Harris_campaign","1083797699021942784","2019-01-11 18:48:02","People have to speak up about the government shutdown and put the pressure on this Administration to reopen the government. There is power in that. 
https://t.co/KLaysEr9yn","","3092","9489"
"Harris","Harris_campaign","1083777838807945218","2019-01-11 17:29:07","For many federal workers, missing a paycheck is a big deal. There is rent to pay now, kids to feed now, and bills that are stacking up. It’s day 21. It’s time for the president and McConnell to end this. 
https://t.co/Y9UXOeIwjn","","2626","8312"
"Harris","Harris_campaign","1083567936848257024","2019-01-11 03:35:02","Glad to be back on the @colbertlateshow to talk about the government shutdown and more. Tune in tonight at 11:35 p.m. ET. https://t.co/BYXxxVvRnT","","421","3479"
"Harris","Harris_campaign","1083546536682897408","2019-01-11 02:10:00","Emma Lazarus’s words, “Give me your tired, your poor, your huddled masses yearning to breathe free,” speaks to the true character of what our country can be: a generous country that respects and embraces those who have made the difficult journey to our shores, often fleeing harm.","","6405","27232"
"Harris","Harris_campaign","1083517642777022464","2019-01-11 00:15:11","My mother was the strongest person I have ever known. https://t.co/IicrfsRD4a","","1675","8677"
"Harris","Harris_campaign","1083487651565617153","2019-01-10 22:16:01","Good news: the deadline for California wildfire survivors to register for federal aid has been extended to January 31. If you or someone you know had their home damaged by the Woolsey or Hill fires, be sure to spread the word. 
https://t.co/mjarf8z9l0","","721","1331"
"Harris","Harris_campaign","1083455447649214464","2019-01-10 20:08:03","It’s the 20th day of the government shutdown. That’s 20 days that 800,000 American workers and their families have had to worry about how long it’s going to take to get their next paycheck. It’s past time for Trump to end the #TrumpShutdown.","","1776","6007"
"Harris","Harris_campaign","1083433545924788224","2019-01-10 18:41:01","The Coast Guard protects and defends our country. Let’s reopen the government, instead of telling Coast Guard families to hold a garage sale or take up dog walking to pay the bills. 
https://t.co/6FYEjJopel","","1412","4060"
"Harris","Harris_campaign","1083406714395901953","2019-01-10 16:54:24","This is horrible and completely unjust. 
https://t.co/Mw9P6Xr2m0","","7970","23380"
"Harris","Harris_campaign","1083210573398052865","2019-01-10 03:55:00","It’s past time America legalized marijuana and regulated it. But when doing so, we need to expunge nonviolent marijuana-related offenses from the records of millions of people who have been arrested and incarcerated so they can get on with their lives.","","12384","57082"
"Harris","Harris_campaign","1083192204838035457","2019-01-10 02:42:01","Let’s confront the truth. Many middle-class Americans are living paycheck to paycheck, even as the costs of health care, tuition, and housing have soared. We need to build an economy that gives dignity and decency to American workers.","","4796","20898"
"Harris","Harris_campaign","1083174334796128261","2019-01-10 01:31:00","Bob Mueller must be allowed to complete his job without any interference.
https://t.co/UKWXWyVrNd","","751","3916"
"Harris","Harris_campaign","1083167704872296453","2019-01-10 01:04:39","Holding the American people hostage over a vanity project is certainly not what a leader or President of the United States is supposed to do.","","5893","30802"
"Harris","Harris_campaign","1083164461849108481","2019-01-10 00:51:46","To the college students here I want to say, hold on to your friends. None of us achieve the success we have right now without the friends we have along the way.","","1056","5922"
"Harris","Harris_campaign","1083156762365227010","2019-01-10 00:21:10","My mother was a force of nature. She was a truth-teller. She was the smartest, toughest person I have ever known. She had two goals in her life: to end breast cancer and to raise her two daughters. https://t.co/TKlzxP3rrq","","258","1775"
"Harris","Harris_campaign","1083151739312881666","2019-01-10 00:01:13","Thankful for everyone who's braving the cold. About to speak at @GWtweets soon. https://t.co/uIKj7JjMH6","","222","1435"
"Harris","Harris_campaign","1083147659752411136","2019-01-09 23:45:00","Another serious repercussion of the government shutdown: hundreds of FDA inspectors have been furloughed, meaning food inspections have been sharply reduced. With last year's notable nationwide food recalls, this is a threat to people's health.
https://t.co/kzzJ1hjmA7","","1714","3252"
"Harris","Harris_campaign","1083140561605967872","2019-01-09 23:16:48","When we talk about the immigration debate, there are powerful forces — including this President — that are attempting to vilify immigrants because they were born in another country. This should offend all of us.
https://t.co/NuWgh1ZNos","","2689","9966"
"Harris","Harris_campaign","1083124506703601664","2019-01-09 22:13:00","“It was an absolute necessity for me to declare homosexuality, because if I didn't I was a part of the prejudice.” 

Chief organizer of the March on Washington, Bayard Rustin, showed true bravery coming out during a time it was dangerous to do so.
https://t.co/yV51iRu2eb","","885","3645"
"Harris","Harris_campaign","1083098590250237953","2019-01-09 20:30:01","RT @TheLeadCNN: Democratic California Sen. @KamalaHarris joins The Lead with @JakeTapper LIVE today at 4 p.m. ET. https://t.co/ux3eDOaizA","","224","0"
"Harris","Harris_campaign","1083093304332468226","2019-01-09 20:09:01","It’s day 19 of the government shutdown and people across this country are hurting from its effects. From canceling a planned surgery to resorting to crowdfunding to pay the bills, lives have been thrown into chaos. This must end. 
https://t.co/e8LrzZVvJX","","1279","3482"
"Harris","Harris_campaign","1083064863335895040","2019-01-09 18:16:00","The American public deserves better.
https://t.co/vIakVJBtU3","","826","3465"
"Harris","Harris_campaign","1083022784895303680","2019-01-09 15:28:48","Californians endured the deadliest wildfire in our state’s history last year. We should work together to mitigate these fires by combating climate change, not play politics by threatening to withhold money from survivors of a deadly natural disaster. https://t.co/uMopf0Z05i","","1882","6173"
"Harris","Harris_campaign","1082833298483802112","2019-01-09 02:55:51","That was unproductive. Time to reopen the government and get back to work for the people.","","9322","59669"
"Harris","Harris_campaign","1082812968247660545","2019-01-09 01:35:03","We need to stay focused on the issues that matter — the 800,000 federal workers who are furloughed or working without out pay right now because the president shut down the government over his vanity project. https://t.co/aJVYo9FNMd","","1972","7060"
"Harris","Harris_campaign","1082798356819312641","2019-01-09 00:37:00","Should the shutdown continue, funding for nutrition assistance will be in jeopardy. This shutdown isn’t just affecting government workers, it’s also hurting poor Americans.
https://t.co/Fz7usg8WOf","","922","2031"
"Harris","Harris_campaign","1082784013075525634","2019-01-08 23:40:00","It’s our job to stand up for those who are not at the table where life-altering decisions are made. Not just those people who look like us. Not just those who need what we need. Our duty is to improve the human condition — in every way we can, for everyone who needs it.","","1181","5383"
"Harris","Harris_campaign","1082778979487174659","2019-01-08 23:20:00","Nora has been with the IRS for over 25 years. “They give you this mass letter that, ok, you can present this to your creditor and let them know that, you know, you’re shut down but you will be paid. That creditor can care less about that letter.” 
https://t.co/xajv9HXnGc","","1716","3602"
"Harris","Harris_campaign","1082767909447974915","2019-01-08 22:36:01","Our national parks are home to some incredible natural wonders. This will only get worse as the #TrumpShutdown continues. 
https://t.co/j4gWvcUUKu","","685","1594"
"Harris","Harris_campaign","1082743243857641472","2019-01-08 20:58:00","Let's be honest about it: Trump's wall won't stop transnational criminal organizations. 
https://t.co/SJCHKkphrY","","3428","12980"
"Harris","Harris_campaign","1082715324884180992","2019-01-08 19:07:03","Today’s the day! Both my books, #TheTruthsWeHold and #SuperheroesAreEverywhere, are available now. I’m excited to share these stories with you and am looking forward to seeing so many of you at my book events in DC, NYC, LA, and SF → https://t.co/sH4UyHMGEk https://t.co/go6hkXMPVw","","247","1109"
"Harris","Harris_campaign","1082666249941860358","2019-01-08 15:52:03","There was a bipartisan effort out of the House and Senate to fund the government, and the president is holding it up because of his vanity wall project, all at the expense of taxpayers and hundreds of thousands of workers. It’s an emergency of his own creation. https://t.co/uu2SwO4Z3b","","3768","11269"
"Harris","Harris_campaign","1082483281097093120","2019-01-08 03:45:00","When you’re struggling to make ends meet because you’re living paycheck to paycheck, have bills that are due, rent to pay, and kids to feed, you can’t afford to have even one paycheck come late.

That’s the reality for countless federal employees right now.","","6728","25348"
"Harris","Harris_campaign","1082463399617925121","2019-01-08 02:26:00","The longest government shutdown was in 1995-1996 and lasted 21 days.

We’re on day 17. Enough. The House passed two bills to reopen the government. McConnell must bring them to the floor so we can get federal employees back to work.","","8893","36139"
"Harris","Harris_campaign","1082451826736271360","2019-01-08 01:40:01","Another shameful attempt by Republican politicians to get between a woman and her doctor.
https://t.co/PbKSRTWAHA","","752","2047"
"Harris","Harris_campaign","1082433150674968576","2019-01-08 00:25:48","My press secretary Tyrone who passed away in October from cancer was always rooting for @ClemsonFB. Tonight, in honor of him, I'm #ALLIN for Clemson. https://t.co/EUtQuADPqu","","627","6530"
"Harris","Harris_campaign","1082425402948235266","2019-01-07 23:55:01","Arming teachers with guns would make our schools less safe. Instead, we should be arming them with fair wages, school supplies, and the resources they need to educate the next generation. 
https://t.co/yRWgK5SoCQ","","2303","9391"
"Harris","Harris_campaign","1082401743722426369","2019-01-07 22:21:00","By supporting policies that will build an economy that works for everyone — such as passing the LIFT Act to address the rising cost of living — we have the opportunity to ensure living paycheck to paycheck is no longer the norm for hardworking Americans.
https://t.co/cTfjEi83Cu","","381","1335"
"Harris","Harris_campaign","1082380103668170756","2019-01-07 20:55:01","I agree, @ChrisVanHollen, the Senate must reopen the government as the first order of business before proceeding with other bills. Federal workers and government contractors are suffering. 
https://t.co/a2lli2FIFw","","560","1910"
"Harris","Harris_campaign","1082369786493968384","2019-01-07 20:14:01","Congratulations, @GavinNewsom, on your swearing in! I know you’ll be a strong leader for California on everything from combating climate change to ensuring everyone can afford to pursue higher education. https://t.co/JKlPJcPr7P","","366","2413"
"Harris","Harris_campaign","1082362498614022144","2019-01-07 19:45:03",".@JerryBrownGov, thank you. Under your dedicated leadership as governor, California has shown the world that you can have a strong economy and combat climate change.","","734","4401"
"Harris","Harris_campaign","1082322950508998657","2019-01-07 17:07:54","""Rent is due, light bill, gas bill, my car bill is due the 26th. I already got my last paycheck and there's no paycheck to come.""

Punishing federal workers by withholding their pay over this border wall is despicable. 
https://t.co/AGbGbhwla7","","13874","35645"
"Harris","Harris_campaign","1082103509489803265","2019-01-07 02:35:55","Rooting for Black Panther at the #GoldenGlobes tonight! One of my favorite movies of 2018. An incredible story and set design that brought Wakanda to life. https://t.co/eHDufWfPE4","","405","4932"
"Harris","Harris_campaign","1082078114589622274","2019-01-07 00:55:01","ICYMI: Congress is a few steps closer to reflecting the diversity and cultures of the people we represent.
https://t.co/HiLWp0fk3O","","424","2122"
"Harris","Harris_campaign","1082059239554772992","2019-01-06 23:40:01","Earlier this week, the House passed a bill to reopen the government. The Senate should vote on it immediately. Federal employees and government contractors should not have to pay the price for the president’s actions.","","5869","23835"
"Harris","Harris_campaign","1082035080724398081","2019-01-06 22:04:01","My first children’s book, #SuperheroesAreEverywhere, comes out on January 8. I’m so excited to share it with children and their families. https://t.co/sH4UyHMGEk https://t.co/jS1ZW8rmE2","","936","5432"
"Harris","Harris_campaign","1082008655950725125","2019-01-06 20:19:00","Instead of tax breaks for big wealthy corporations and the top 1%, we should be making our tax code work for middle-class Americans. The LIFT Act does just that by helping address the rising costs of housing, tuition, childcare, and more.","","2490","9815"
"Harris","Harris_campaign","1081955812732534784","2019-01-06 16:49:02","It’s been two weeks since Trump shut down the government and the Republican-controlled Congress let the Violence Against Women Act expire. 
https://t.co/Xu4ON7SACc","","3424","7665"
"Harris","Harris_campaign","1081754981869465600","2019-01-06 03:31:00","The longest government shutdown in U.S. history was 21 days. We’re now on day 15. Federal workers and government contractors can’t wait months or years for their next paycheck.","","8016","35267"
"Harris","Harris_campaign","1081737871919333376","2019-01-06 02:23:01","Progress. But we can’t stop speaking out about this until every single child is reunited with their family. 
https://t.co/ncJ5N6nw5L","","2143","8024"
"Harris","Harris_campaign","1081699868731682819","2019-01-05 23:52:00","An alert seconds before an earthquake could save countless lives — including your own. If you’re in LA County, you’re going to want to download this app. 
https://t.co/E9qpdXRBOB","","858","2488"
"Harris","Harris_campaign","1081685782870544385","2019-01-05 22:56:02","Women now make up 23% of the House — but there’s still a long way to go until Congress fully reflects the population in America. https://t.co/JUKGpMdKtL","","496","2247"
"Harris","Harris_campaign","1081674199792525312","2019-01-05 22:10:00","Some TSA agents who are single parents can no longer afford childcare and are home with the kids. Others are calling out to work other jobs so they can pay their rent and bills this month. This prolonged shutdown is having a real impact on the people who protect our airports. https://t.co/8bvTvQ8NdF","","9687","23473"
"Harris","Harris_campaign","1081650795446185984","2019-01-05 20:37:00","Californians: there are only 10 days left to sign up for health insurance and get yourself covered for the new year. Taking care of your health is so important. January 15 is the last day to enroll, so don’t delay — go to https://t.co/ulGnArohz1 today.","","528","988"
"Harris","Harris_campaign","1081621541270536192","2019-01-05 18:40:45","The only one standing in the way of reopening the government is the president. https://t.co/C4kDRbE4eJ","","3729","11247"
"Harris","Harris_campaign","1081391590378229761","2019-01-05 03:27:01","Over and over, working people have shown that when they have power and organize, our society changes for the better. When workers’ right to band together for the wages and benefits they’ve earned is under attack, we must stand up and fight back.","","2184","10014"
"Harris","Harris_campaign","1081369193029820416","2019-01-05 01:58:01","✅Automatic voter registration
✅Independent redistricting commissions
✅Super PAC restrictions
✅Ethics reforms
✅Election security

Change is coming. #ForThePeople
https://t.co/AyzmOEeLCE","","2288","7515"
"Harris","Harris_campaign","1081337480845189121","2019-01-04 23:52:00","It’s absolutely shameful how Native Americans are being disproportionately affected by the government shutdown. 
https://t.co/8tEefhhs0u","","4360","9026"
"Harris","Harris_campaign","1081323396116426752","2019-01-04 22:56:02","#TheTruthsWeHold, coming out on January 8, discusses the defining moments in my life and the core truths that unite us as a country. Join me on tour and find out where you can get a copy: https://t.co/sH4UyHMGEk https://t.co/Nq2EpwV1Kh","","324","1642"
"Harris","Harris_campaign","1081310053804716032","2019-01-04 22:03:01","My first priority in the new Congress was to re-introduce the LIFT Act — a real tax cut for the middle class. When more than four in ten adults say they don’t have enough to cover a $400 emergency expense, Congress must act. No one should struggle just to get by.","","1667","6996"
"Harris","Harris_campaign","1081272318595420163","2019-01-04 19:33:04","Just to go on record. I’m for *more* dancing in politics not less. https://t.co/aCu9xofwM0","","9975","70280"
"Harris","Harris_campaign","1081260232427356160","2019-01-04 18:45:02","There’s a lot to smile about from yesterday. 📷: Jim Lo Scalzo https://t.co/Pcj0uCc8ru","","622","5465"
"Harris","Harris_campaign","1081229418507440128","2019-01-04 16:42:36","Last night, the House passed two bills with bipartisan support to re-open the government. It’s now on McConnell to bring one of them to the floor. Let’s do the right thing for federal employees and government contractors and the American people. End this shutdown.","","6156","27338"
"Harris","Harris_campaign","1081031213077401600","2019-01-04 03:35:00","Deliberately ignoring the global threat of climate change and, instead, favoring polluters over Americans’ health won’t make our country stronger. We can’t leave our children and our children’s children to deal with the consequences of our inaction.","","4562","19509"
"Harris","Harris_campaign","1081003278819840000","2019-01-04 01:44:00","We should be encouraging all voters to participate in our democracy, not making it harder for them to cast their ballot.
https://t.co/e6KCulzyu8","","1036","4038"
"Harris","Harris_campaign","1080977130400432128","2019-01-04 00:00:06","Many pharmaceutical giants pocketed a massive tax cut last year. Instead of using that money to cut prices on prescription drugs, they’re raising prices an average of 6.3% on more than 250 prescription drugs.
https://t.co/mR3HJBg7It","","2959","4302"
"Harris","Harris_campaign","1080949940346634240","2019-01-03 22:12:03","Great to see @RepWilson and @rolandsmartin at the @OfficialCBC ceremonial swearing-in earlier this morning. The Caucus is officially 55 members strong and we're ready to get to work in the #116thCongress to reform our criminal justice system, combat voter suppression, and more. https://t.co/S4JbzTr0iO","","224","1474"
"Harris","Harris_campaign","1080919236581777410","2019-01-03 20:10:03","In her new position, Shuwanza Goff wants to help change the lives of other young people of color in politics. “I’m hopeful that in my role...I am able to help more junior staffers find their way, climb up and eventually consume and take over some of these more senior roles.” https://t.co/Ryc7EXOTZI","","356","1832"
"Harris","Harris_campaign","1080899094938300417","2019-01-03 18:50:01","Congratulations to California’s own @NancyPelosi for reclaiming the speaker's gavel today. I look forward to seeing all the House will accomplish to help the American people.","","4623","34548"
"Harris","Harris_campaign","1080866383997665280","2019-01-03 16:40:02","Today is truly a historic day. Welcome, #116thCongress! 
https://t.co/oultKwgaKA","","5895","33368"
"Harris","Harris_campaign","1080677646709739520","2019-01-03 04:10:03","Our country is facing a mental health crisis, yet far too many Americans don't receive the treatment they need due to lack of access or stigma. With ~123M Americans living in an area with a shortage of mental health professionals, it’s vital we expand access to these services.","","3874","16349"
"Harris","Harris_campaign","1080641393792557057","2019-01-03 01:46:00","From proposed changes to Title IX to make it harder for sexual assault victims to seek justice, to attempts to restrict birth control accessibility, attacks on women’s health continue into 2019. 
https://t.co/gLtmiYQzyO","","900","2065"
"Harris","Harris_campaign","1080623023504482304","2019-01-03 00:33:00","Read this and share with your friends and family. We can’t allow the effects of the government shutdown on Native American tribes to be overlooked. 
https://t.co/GAr2ug6ggW","","3526","5163"
"Harris","Harris_campaign","1080602641397370880","2019-01-02 23:12:00","RT @nytopinion: ""I am so grateful my mother had Medicare, and I will fight for it to be guaranteed to all,"" Senator @KamalaHarris writes ht…","","170","0"
"Harris","Harris_campaign","1080572200674041858","2019-01-02 21:11:03","Tomorrow is going to be a historic day on Capitol Hill, with over 100 women being sworn in to the 116th Congress — a new record.

The future is bright. 📷: Martin Schoeller https://t.co/XTOSr0C4iB","","15613","73837"
"Harris","Harris_campaign","1080557091742466053","2019-01-02 20:11:01","Some good news to kick off 2019 but we can’t stop there. Raising the minimum wage to $15 an hour is the right thing to do for America’s workers to help them keep a roof over their head or food on the table. #FightFor15
https://t.co/qFDKhiRTwh","","521","2295"
"Harris","Harris_campaign","1080513051357573121","2019-01-02 17:16:01","It’s day twelve of the government shutdown. That’s twelve days of uncertainty and anxiety for federal workers and government contractors who are being used as a bargaining chip in exchange for an unnecessary and wasteful border wall.","","4203","14291"
"Harris","Harris_campaign","1080290079594237952","2019-01-02 02:30:00","The day my mother told my sister and me that she had colon cancer was one of the worst days of my life. But I remember being so grateful that my mother had Medicare. We must work toward guaranteeing it to all.","","5379","36936"
"Harris","Harris_campaign","1080254652418007041","2019-01-02 00:09:13","Cooked New Year’s Day dinner with my best friend for our families. Black-eyed peas for good luck. Greens for prosperity. https://t.co/i2U7w1FeDE","","792","9582"
"Harris","Harris_campaign","1080219365717536769","2019-01-01 21:49:00","A $5,751 bill for getting an ice pack at a hospital. A $236 pregnancy test. $60 for ibuprofen at the local children’s hospital. 

Too many Americans have to resort to crowd-funding to pay for their outrageous medical bills. Our health care system must change. #MedicareforAll https://t.co/rUtgqpn33l","","8527","20891"
"Harris","Harris_campaign","1080161878200995847","2019-01-01 18:00:34","Engaging in the fight for civil rights and social justice is not for the faint of heart. It is as difficult as it is important, and the wins may never taste as sweet as the losses taste sour. But count yourself as part of the lineage of those who refused to relent.","","3611","14165"
"Harris","Harris_campaign","1079911341626925058","2019-01-01 01:25:02","Wishing you and your family a safe and happy new year! https://t.co/Hanf6BHMAH","","1301","16227"
